tcpdump: WARNING: any: That device doesn't support promiscuous mode
(Promiscuous mode not supported on the "any" device)
tcpdump: verbose output suppressed, use -v[v]... for full protocol decode
listening on any, link-type LINUX_SLL2 (Linux cooked v2), snapshot length 262144 bytes
16:40:59.897675 wlo1  In  IP 140.82.114.25.443 > 192.168.0.108.51090: Flags [.], ack 244571609, win 85, options [nop,nop,TS val 1654320749 ecr 2544374561], length 0
16:40:59.979581 wlo1  Out IP 192.168.0.108.55814 > 157.90.91.73.443: Flags [.], ack 3177753140, win 54, options [nop,nop,TS val 2514192377 ecr 2626518781], length 0
16:41:00.157154 wlo1  In  IP 157.90.91.73.443 > 192.168.0.108.55814: Flags [.], ack 1, win 487, options [nop,nop,TS val 2626564227 ecr 2514146930], length 0
16:41:00.490813 wlo1  Out IP 192.168.0.108.53504 > 172.66.161.126.443: Flags [.], ack 2197460617, win 334, options [nop,nop,TS val 54150788 ecr 4264624481], length 0
16:41:00.667652 wlo1  Out IP 192.168.0.108.46075 > 192.168.0.1.53: 9243+ [1au] HTTPS? ol-collector.quillbot.com. (54)
16:41:00.667768 wlo1  Out IP 192.168.0.108.40504 > 192.168.0.1.53: 6089+ [1au] HTTPS? _5222._https.web.whatsapp.com. (58)
16:41:00.667815 wlo1  Out IP 192.168.0.108.51841 > 192.168.0.1.53: 28956+ [1au] HTTPS? mmx-ds.cdn.whatsapp.net. (52)
16:41:00.667858 wlo1  Out IP 192.168.0.108.55169 > 192.168.0.1.53: 12045+ [1au] HTTPS? api2.amplitude.com. (47)
16:41:00.667900 wlo1  Out IP 192.168.0.108.34630 > 192.168.0.1.53: 57879+ [1au] HTTPS? s3-w.us-east-1.amazonaws.com. (57)
16:41:00.667939 wlo1  Out IP 192.168.0.108.43052 > 192.168.0.1.53: 38072+ [1au] HTTPS? collector.quillbot.com. (51)
16:41:00.673264 wlo1  In  IP 172.66.161.126.443 > 192.168.0.108.53504: Flags [.], ack 1, win 16, options [nop,nop,TS val 4264669824 ecr 54105409], length 0
16:41:01.002778 wlo1  Out IP 192.168.0.108.56456 > 3.213.49.30.443: Flags [.], ack 1053707454, win 59, options [nop,nop,TS val 3134941225 ecr 1015122912], length 0
16:41:01.356143 wlo1  In  IP 3.213.49.30.443 > 192.168.0.108.56456: Flags [.], ack 1, win 292, options [nop,nop,TS val 1015168614 ecr 3134895786], length 0
16:41:01.417701 wlo1  Out IP 192.168.0.108.60902 > 192.168.0.1.53: 52847+ [1au] HTTPS? rank.similarweb.com. (48)
16:41:01.417777 wlo1  Out IP 192.168.0.108.38412 > 192.168.0.1.53: 1305+ [1au] HTTPS? api1.sider.ai. (42)
16:41:01.417817 wlo1  Out IP 192.168.0.108.52154 > 192.168.0.1.53: 9833+ [1au] HTTPS? clicks-inges-vjld0bvlni6m-1474043380.us-east-1.elb.amazonaws.com. (93)
16:41:01.417902 wlo1  Out IP 192.168.0.108.45143 > 192.168.0.1.53: 23382+ [1au] HTTPS? ogads-pa.clients6.google.com. (57)
16:41:02.381654 wlo1  In  IP 16.15.191.255.443 > 192.168.0.108.38006: Flags [P.], seq 1913952361:1913952385, ack 2013010976, win 224, options [nop,nop,TS val 1300837354 ecr 3101227700], length 24
16:41:02.381657 wlo1  In  IP 16.15.191.255.443 > 192.168.0.108.38006: Flags [F.], seq 24, ack 1, win 224, options [nop,nop,TS val 1300837354 ecr 3101227700], length 0
16:41:02.417700 wlo1  Out IP 192.168.0.108.52223 > 192.168.0.1.53: 58068+ [1au] HTTPS? www-alv.google-analytics.com. (57)
16:41:02.417813 wlo1  Out IP 192.168.0.108.42472 > 192.168.0.1.53: 60083+ [1au] HTTPS? optimizationguide-pa.googleapis.com. (64)
16:41:02.417845 wlo1  Out IP 192.168.0.108.50574 > 192.168.0.1.53: 61245+ [1au] HTTPS? safebrowsing.googleapis.com. (56)
16:41:02.422689 wlo1  Out IP 192.168.0.108.38006 > 16.15.191.255.443: Flags [.], ack 25, win 57, options [nop,nop,TS val 3101233688 ecr 1300837354], length 0
16:41:02.538771 wlo1  Out IP 192.168.0.108.35308 > 74.125.200.188.5228: Flags [.], ack 1859589454, win 57, options [nop,nop,TS val 2575593795 ecr 916676636], length 0
16:41:02.538805 wlo1  Out IP 192.168.0.108.40788 > 49.44.50.72.443: Flags [.], ack 552046638, win 63, options [nop,nop,TS val 1028146108 ecr 989305262], length 0
16:41:02.555672 wlo1  In  IP 49.44.50.72.443 > 192.168.0.108.40788: Flags [.], ack 1, win 567, options [nop,nop,TS val 989350319 ecr 1027784902], length 0
16:41:02.623123 wlo1  In  IP 74.125.200.188.5228 > 192.168.0.108.35308: Flags [.], ack 1, win 1044, options [nop,nop,TS val 916725721 ecr 2574433757], length 0
16:41:02.917583 wlo1  Out IP 192.168.0.108.37363 > 192.168.0.1.53: 53369+ [1au] HTTPS? play.google.com. (44)
16:41:02.917645 wlo1  Out IP 192.168.0.108.46857 > 192.168.0.1.53: 22998+ [1au] HTTPS? ssl.gstatic.com. (44)
16:41:03.406214 wlo1  In  IP 104.18.39.21.443 > 192.168.0.108.41652: Flags [P.], seq 307501496:307501520, ack 3033045968, win 17, options [nop,nop,TS val 1402786230 ecr 1089292085], length 24
16:41:03.406613 wlo1  Out IP 192.168.0.108.41652 > 104.18.39.21.443: Flags [P.], seq 1:29, ack 24, win 59, options [nop,nop,TS val 1089312053 ecr 1402786230], length 28
16:41:03.417585 wlo1  Out IP 192.168.0.108.34666 > 192.168.0.1.53: 22164+ [1au] HTTPS? beacons-handoff.gcp.gvt2.com. (57)
16:41:03.420724 wlo1  In  IP 104.18.39.21.443 > 192.168.0.108.41652: Flags [.], ack 29, win 17, options [nop,nop,TS val 1402786293 ecr 1089312053], length 0
16:41:03.825350 wlo1  Out IP 192.168.0.108.55407 > 142.251.223.100.443: UDP, length 29
16:41:03.842275 wlo1  In  IP 142.251.223.100.443 > 192.168.0.108.55407: UDP, length 26
16:41:05.044508 wlo1  In  IP 104.18.36.252.443 > 192.168.0.108.54276: Flags [P.], seq 2940183219:2940183354, ack 3888365291, win 18, options [nop,nop,TS val 2408427596 ecr 3037513685], length 135
16:41:05.045084 wlo1  Out IP 192.168.0.108.54276 > 104.18.36.252.443: Flags [P.], seq 1:29, ack 135, win 61, options [nop,nop,TS val 3037528739 ecr 2408427596], length 28
16:41:05.046375 wlo1  Out IP 192.168.0.108.54276 > 104.18.36.252.443: Flags [P.], seq 29:149, ack 135, win 61, options [nop,nop,TS val 3037528740 ecr 2408427596], length 120
16:41:05.060924 wlo1  In  IP 104.18.36.252.443 > 192.168.0.108.54276: Flags [.], ack 29, win 18, options [nop,nop,TS val 2408427752 ecr 3037528739], length 0
16:41:05.060928 wlo1  In  IP 104.18.36.252.443 > 192.168.0.108.54276: Flags [.], ack 149, win 18, options [nop,nop,TS val 2408427752 ecr 3037528740], length 0
16:41:05.917603 wlo1  Out IP 192.168.0.108.43052 > 192.168.0.1.53: 38072+ [1au] HTTPS? collector.quillbot.com. (51)
16:41:05.917777 wlo1  Out IP 192.168.0.108.55169 > 192.168.0.1.53: 12045+ [1au] HTTPS? api2.amplitude.com. (47)
16:41:05.917892 wlo1  Out IP 192.168.0.108.40504 > 192.168.0.1.53: 6089+ [1au] HTTPS? _5222._https.web.whatsapp.com. (58)
16:41:06.634738 wlo1  Out IP 192.168.0.108.35824 > 172.64.155.209.443: Flags [.], ack 3205167786, win 119, options [nop,nop,TS val 638485555 ecr 1702317192], length 0
16:41:06.651332 wlo1  In  IP 172.64.155.209.443 > 192.168.0.108.35824: Flags [.], ack 1, win 25, options [nop,nop,TS val 1702362248 ecr 638258484], length 0
16:41:06.667600 wlo1  Out IP 192.168.0.108.60902 > 192.168.0.1.53: 52847+ [1au] HTTPS? rank.similarweb.com. (48)
16:41:06.668196 wlo1  Out IP 192.168.0.108.52154 > 192.168.0.1.53: 9833+ [1au] HTTPS? clicks-inges-vjld0bvlni6m-1474043380.us-east-1.elb.amazonaws.com. (93)
16:41:06.668289 wlo1  Out IP 192.168.0.108.38412 > 192.168.0.1.53: 1305+ [1au] HTTPS? api1.sider.ai. (42)
16:41:07.667646 wlo1  Out IP 192.168.0.108.52223 > 192.168.0.1.53: 58068+ [1au] HTTPS? www-alv.google-analytics.com. (57)
16:41:08.167650 wlo1  Out IP 192.168.0.108.46857 > 192.168.0.1.53: 22998+ [1au] HTTPS? ssl.gstatic.com. (44)
16:41:08.382380 wlo1  Out IP 192.168.0.108.41652 > 104.18.39.21.443: Flags [P.], seq 29:119, ack 24, win 59, options [nop,nop,TS val 1089317028 ecr 1402786293], length 90
16:41:08.410774 wlo1  In  IP 104.18.39.21.443 > 192.168.0.108.41652: Flags [.], ack 119, win 17, options [nop,nop,TS val 1402791281 ecr 1089317028], length 0
16:41:08.667572 wlo1  Out IP 192.168.0.108.34666 > 192.168.0.1.53: 22164+ [1au] HTTPS? beacons-handoff.gcp.gvt2.com. (57)
16:41:08.674849 wlo1  In  IP 104.18.39.21.443 > 192.168.0.108.41652: Flags [P.], seq 24:103, ack 119, win 17, options [nop,nop,TS val 1402791490 ecr 1089317028], length 79
16:41:08.715605 wlo1  Out IP 192.168.0.108.41652 > 104.18.39.21.443: Flags [.], ack 103, win 59, options [nop,nop,TS val 1089317362 ecr 1402791490], length 0
16:41:11.124936 wlo1  Out IP 192.168.0.108.36603 > 142.251.223.100.443: UDP, length 1250
16:41:11.124975 wlo1  Out IP 192.168.0.108.36603 > 142.251.223.100.443: UDP, length 1250
16:41:11.124996 wlo1  Out IP 192.168.0.108.36603 > 142.251.223.100.443: UDP, length 1250
16:41:11.125186 wlo1  Out IP 192.168.0.108.36603 > 142.251.223.100.443: UDP, length 80
16:41:11.125602 wlo1  Out IP 192.168.0.108.36603 > 142.251.223.100.443: UDP, length 1246
16:41:11.125616 wlo1  Out IP 192.168.0.108.36603 > 142.251.223.100.443: UDP, length 1176
16:41:11.130648 wlo1  Out IP 192.168.0.108.44995 > 142.251.223.100.443: UDP, length 1250
16:41:11.130700 wlo1  Out IP 192.168.0.108.44995 > 142.251.223.100.443: UDP, length 1250
16:41:11.131226 wlo1  Out IP 192.168.0.108.44995 > 142.251.223.100.443: UDP, length 80
16:41:11.131660 wlo1  Out IP 192.168.0.108.44995 > 142.251.223.100.443: UDP, length 1246
16:41:11.131674 wlo1  Out IP 192.168.0.108.44995 > 142.251.223.100.443: UDP, length 868
16:41:11.146031 wlo1  In  IP 142.251.223.100.443 > 192.168.0.108.44995: UDP, length 40
16:41:11.146033 wlo1  In  IP 142.251.223.100.443 > 192.168.0.108.44995: UDP, length 1250
16:41:11.148689 wlo1  In  IP 142.251.223.100.443 > 192.168.0.108.44995: UDP, length 1250
16:41:11.148691 wlo1  In  IP 142.251.223.100.443 > 192.168.0.108.44995: UDP, length 307
16:41:11.148692 wlo1  In  IP 142.251.223.100.443 > 192.168.0.108.44995: UDP, length 943
16:41:11.148692 wlo1  In  IP 142.251.223.100.443 > 192.168.0.108.44995: UDP, length 80
16:41:11.148693 wlo1  In  IP 142.251.223.100.443 > 192.168.0.108.44995: UDP, length 23
16:41:11.148753 wlo1  In  IP 142.251.223.100.443 > 192.168.0.108.36603: UDP, length 40
16:41:11.148754 wlo1  In  IP 142.251.223.100.443 > 192.168.0.108.36603: UDP, length 42
16:41:11.148754 wlo1  In  IP 142.251.223.100.443 > 192.168.0.108.36603: UDP, length 1250
16:41:11.149475 wlo1  In  IP 142.251.223.100.443 > 192.168.0.108.44995: UDP, length 22
16:41:11.149936 wlo1  Out IP 192.168.0.108.44995 > 142.251.223.100.443: UDP, length 78
16:41:11.150045 wlo1  Out IP 192.168.0.108.44995 > 142.251.223.100.443: UDP, length 31
16:41:11.150166 wlo1  Out IP 192.168.0.108.44995 > 142.251.223.100.443: UDP, length 31
16:41:11.152961 wlo1  In  IP 142.251.223.100.443 > 192.168.0.108.36603: UDP, length 1250
16:41:11.152962 wlo1  In  IP 142.251.223.100.443 > 192.168.0.108.36603: UDP, length 309
16:41:11.152963 wlo1  In  IP 142.251.223.100.443 > 192.168.0.108.36603: UDP, length 941
16:41:11.152963 wlo1  In  IP 142.251.223.100.443 > 192.168.0.108.36603: UDP, length 82
16:41:11.152964 wlo1  In  IP 142.251.223.100.443 > 192.168.0.108.36603: UDP, length 24
16:41:11.153830 wlo1  Out IP 192.168.0.108.36603 > 142.251.223.100.443: UDP, length 78
16:41:11.153912 wlo1  Out IP 192.168.0.108.36603 > 142.251.223.100.443: UDP, length 31
16:41:11.157569 wlo1  In  IP 142.251.223.100.443 > 192.168.0.108.36603: UDP, length 22
16:41:11.158034 wlo1  Out IP 192.168.0.108.36603 > 142.251.223.100.443: UDP, length 31
16:41:11.165767 wlo1  In  IP 142.251.223.100.443 > 192.168.0.108.44995: UDP, length 120
16:41:11.167406 wlo1  Out IP 192.168.0.108.43052 > 192.168.0.1.53: 38072+ [1au] HTTPS? collector.quillbot.com. (51)
16:41:11.167550 wlo1  Out IP 192.168.0.108.40504 > 192.168.0.1.53: 6089+ [1au] HTTPS? _5222._https.web.whatsapp.com. (58)
16:41:11.167592 wlo1  Out IP 192.168.0.108.55169 > 192.168.0.1.53: 12045+ [1au] HTTPS? api2.amplitude.com. (47)
16:41:11.170602 wlo1  In  IP 142.251.223.100.443 > 192.168.0.108.36603: UDP, length 120
16:41:11.192385 wlo1  Out IP 192.168.0.108.44995 > 142.251.223.100.443: UDP, length 32
16:41:11.196779 wlo1  Out IP 192.168.0.108.36603 > 142.251.223.100.443: UDP, length 32
16:41:11.242581 wlo1  In  IP 142.251.223.100.443 > 192.168.0.108.44995: UDP, length 1246
16:41:11.242585 wlo1  In  IP 142.251.223.100.443 > 192.168.0.108.44995: UDP, length 921
16:41:11.242699 wlo1  In  IP 142.251.223.100.443 > 192.168.0.108.36603: UDP, length 1246
16:41:11.242700 wlo1  In  IP 142.251.223.100.443 > 192.168.0.108.36603: UDP, length 701
16:41:11.242701 wlo1  In  IP 142.251.223.100.443 > 192.168.0.108.36603: UDP, length 209
16:41:11.243314 wlo1  Out IP 192.168.0.108.44995 > 142.251.223.100.443: UDP, length 35
16:41:11.243687 wlo1  Out IP 192.168.0.108.36603 > 142.251.223.100.443: UDP, length 35
16:41:11.249914 wlo1  Out IP 192.168.0.108.55121 > 142.250.29.94.443: UDP, length 1250
16:41:11.249959 wlo1  Out IP 192.168.0.108.55121 > 142.250.29.94.443: UDP, length 1250
16:41:11.250166 wlo1  Out IP 192.168.0.108.55121 > 142.250.29.94.443: UDP, length 79
16:41:11.258639 wlo1  In  IP 142.251.223.100.443 > 192.168.0.108.44995: UDP, length 23
16:41:11.258674 wlo1  In  IP 142.251.223.100.443 > 192.168.0.108.36603: UDP, length 23
16:41:11.266428 wlo1  In  IP 142.250.29.94.443 > 192.168.0.108.55121: UDP, length 40
16:41:11.266431 wlo1  In  IP 142.250.29.94.443 > 192.168.0.108.55121: UDP, length 1250
16:41:11.266431 wlo1  In  IP 142.250.29.94.443 > 192.168.0.108.55121: UDP, length 1250
16:41:11.266432 wlo1  In  IP 142.250.29.94.443 > 192.168.0.108.55121: UDP, length 308
16:41:11.266433 wlo1  In  IP 142.250.29.94.443 > 192.168.0.108.55121: UDP, length 942
16:41:11.266433 wlo1  In  IP 142.250.29.94.443 > 192.168.0.108.55121: UDP, length 35
16:41:11.267714 wlo1  Out IP 192.168.0.108.55121 > 142.250.29.94.443: UDP, length 78
16:41:11.267803 wlo1  Out IP 192.168.0.108.55121 > 142.250.29.94.443: UDP, length 31
16:41:11.268075 wlo1  Out IP 192.168.0.108.55121 > 142.250.29.94.443: UDP, length 617
16:41:11.269219 wlo1  Out IP 192.168.0.108.36603 > 142.251.223.100.443: UDP, length 32
16:41:11.282352 wlo1  In  IP 142.250.29.94.443 > 192.168.0.108.55121: UDP, length 126
16:41:11.282358 wlo1  In  IP 142.250.29.94.443 > 192.168.0.108.55121: UDP, length 29
16:41:11.282611 wlo1  Out IP 192.168.0.108.55121 > 142.250.29.94.443: UDP, length 32
16:41:11.355169 wlo1  In  IP 142.250.29.94.443 > 192.168.0.108.55121: UDP, length 564
16:41:11.355172 wlo1  In  IP 142.250.29.94.443 > 192.168.0.108.55121: UDP, length 21
16:41:11.356310 wlo1  Out IP 192.168.0.108.55121 > 142.250.29.94.443: UDP, length 35
16:41:11.396152 wlo1  In  IP 142.250.29.94.443 > 192.168.0.108.55121: UDP, length 24
16:41:11.917570 wlo1  Out IP 192.168.0.108.38412 > 192.168.0.1.53: 1305+ [1au] HTTPS? api1.sider.ai. (42)
16:41:11.917641 wlo1  Out IP 192.168.0.108.52154 > 192.168.0.1.53: 9833+ [1au] HTTPS? clicks-inges-vjld0bvlni6m-1474043380.us-east-1.elb.amazonaws.com. (93)
16:41:12.917676 wlo1  Out IP 192.168.0.108.52223 > 192.168.0.1.53: 58068+ [1au] HTTPS? www-alv.google-analytics.com. (57)
16:41:13.417405 wlo1  Out IP 192.168.0.108.46857 > 192.168.0.1.53: 22998+ [1au] HTTPS? ssl.gstatic.com. (44)
16:41:13.850753 wlo1  In  IP 140.82.114.25.443 > 192.168.0.108.51090: Flags [P.], seq 0:41, ack 1, win 85, options [nop,nop,TS val 1654334721 ecr 2544374561], length 41
16:41:13.851338 wlo1  Out IP 192.168.0.108.51090 > 140.82.114.25.443: Flags [P.], seq 1:46, ack 41, win 61, options [nop,nop,TS val 2544434567 ecr 1654334721], length 45
16:41:13.917645 wlo1  Out IP 192.168.0.108.34666 > 192.168.0.1.53: 22164+ [1au] HTTPS? beacons-handoff.gcp.gvt2.com. (57)
16:41:14.260820 wlo1  In  IP 140.82.114.25.443 > 192.168.0.108.51090: Flags [.], ack 46, win 85, options [nop,nop,TS val 1654335055 ecr 2544434567], length 0
16:41:14.826760 wlo1  Out IP 192.168.0.108.55670 > 157.90.91.73.443: Flags [.], ack 3218157073, win 51, options [nop,nop,TS val 2514207224 ecr 2626532484], length 0
16:41:15.079701 wlo1  In  IP 157.90.91.73.443 > 192.168.0.108.55670: Flags [.], ack 1, win 490, options [nop,nop,TS val 2626579078 ecr 2514115000], length 0
16:41:15.852476 wlo1  Out IP 192.168.0.108.51090 > 140.82.114.25.443: Flags [F.], seq 46, ack 41, win 61, options [nop,nop,TS val 2544436568 ecr 1654335055], length 0
16:41:16.005946 lo    In  IP 127.0.0.1.63966 > 127.0.0.53.53: 50764+ HTTPS? alive.github.com. (34)
16:41:16.006046 lo    In  IP 127.0.0.1.52419 > 127.0.0.53.53: 11381+ A? alive.github.com. (34)
16:41:16.006499 wlo1  Out IP 192.168.0.108.56680 > 192.168.0.1.53: 28858+ [1au] HTTPS? alive.github.com. (45)
16:41:16.006719 wlo1  Out IP 192.168.0.108.49613 > 192.168.0.1.53: 47369+ [1au] A? alive.github.com. (45)
16:41:16.024475 wlo1  In  IP 192.168.0.1.53 > 192.168.0.108.56680: 28858 1/1/1 CNAME live.github.com. (148)
16:41:16.025142 wlo1  Out IP 192.168.0.108.57158 > 192.168.0.1.53: 14812+ [1au] HTTPS? live.github.com. (44)
16:41:16.025392 wlo1  In  IP 192.168.0.1.53 > 192.168.0.108.49613: 47369 2/0/1 CNAME live.github.com., A 140.82.112.26 (80)
16:41:16.025726 lo    In  IP 127.0.0.53.53 > 127.0.0.1.52419: 11381 2/0/0 CNAME live.github.com., A 140.82.112.26 (69)
16:41:16.031383 wlo1  Out IP 192.168.0.108.57530 > 140.82.112.26.443: Flags [S], seq 2566675841, win 64240, options [mss 1460,sackOK,TS val 2638216764 ecr 0,nop,wscale 10], length 0
16:41:16.091032 wlo1  In  IP 140.82.114.25.443 > 192.168.0.108.51090: Flags [P.], seq 41:65, ack 47, win 85, options [nop,nop,TS val 1654337059 ecr 2544436568], length 24
16:41:16.091033 wlo1  In  IP 140.82.114.25.443 > 192.168.0.108.51090: Flags [F.], seq 65, ack 47, win 85, options [nop,nop,TS val 1654337060 ecr 2544436568], length 0
16:41:16.091098 wlo1  Out IP 192.168.0.108.51090 > 140.82.114.25.443: Flags [R], seq 244571655, win 0, length 0
16:41:16.091116 wlo1  Out IP 192.168.0.108.51090 > 140.82.114.25.443: Flags [R], seq 244571655, win 0, length 0
16:41:16.417463 wlo1  Out IP 192.168.0.108.43052 > 192.168.0.1.53: 38072+ [1au] HTTPS? collector.quillbot.com. (51)
16:41:16.417552 wlo1  Out IP 192.168.0.108.55169 > 192.168.0.1.53: 12045+ [1au] HTTPS? api2.amplitude.com. (47)
16:41:16.421977 wlo1  In  IP 140.82.112.26.443 > 192.168.0.108.57530: Flags [S.], seq 1343895016, ack 2566675842, win 65535, options [mss 1436,sackOK,TS val 2808728473 ecr 2638216764,nop,wscale 10], length 0
16:41:16.422045 wlo1  Out IP 192.168.0.108.57530 > 140.82.112.26.443: Flags [.], ack 1, win 63, options [nop,nop,TS val 2638217155 ecr 2808728473], length 0
16:41:16.422676 wlo1  Out IP 192.168.0.108.57530 > 140.82.112.26.443: Flags [P.], seq 1:1858, ack 1, win 63, options [nop,nop,TS val 2638217156 ecr 2808728473], length 1857
16:41:16.924350 wlo1  In  IP 140.82.112.26.443 > 192.168.0.108.57530: Flags [.], ack 1858, win 68, options [nop,nop,TS val 2808728866 ecr 2638217156], length 0
16:41:16.924352 wlo1  In  IP 140.82.112.26.443 > 192.168.0.108.57530: Flags [P.], seq 1:2849, ack 1858, win 68, options [nop,nop,TS val 2808728866 ecr 2638217156], length 2848
16:41:16.924352 wlo1  In  IP 140.82.112.26.443 > 192.168.0.108.57530: Flags [P.], seq 2849:3496, ack 1858, win 68, options [nop,nop,TS val 2808728866 ecr 2638217156], length 647
16:41:16.924411 wlo1  Out IP 192.168.0.108.57530 > 140.82.112.26.443: Flags [.], ack 2849, win 61, options [nop,nop,TS val 2638217657 ecr 2808728866], length 0
16:41:16.924427 wlo1  Out IP 192.168.0.108.57530 > 140.82.112.26.443: Flags [.], ack 3496, win 61, options [nop,nop,TS val 2638217657 ecr 2808728866], length 0
16:41:16.925362 wlo1  Out IP 192.168.0.108.57530 > 140.82.112.26.443: Flags [P.], seq 1858:1922, ack 3496, win 61, options [nop,nop,TS val 2638217658 ecr 2808728866], length 64
16:41:16.925718 wlo1  Out IP 192.168.0.108.57530 > 140.82.112.26.443: Flags [P.], seq 1922:3071, ack 3496, win 61, options [nop,nop,TS val 2638217659 ecr 2808728866], length 1149
16:41:17.167461 wlo1  Out IP 192.168.0.108.38412 > 192.168.0.1.53: 1305+ [1au] HTTPS? api1.sider.ai. (42)
16:41:17.167562 wlo1  Out IP 192.168.0.108.52154 > 192.168.0.1.53: 9833+ [1au] HTTPS? clicks-inges-vjld0bvlni6m-1474043380.us-east-1.elb.amazonaws.com. (93)
16:41:17.197895 wlo1  In  IP 140.82.112.26.443 > 192.168.0.108.57530: Flags [P.], seq 3496:3575, ack 1922, win 68, options [nop,nop,TS val 2808729367 ecr 2638217658], length 79
16:41:17.197899 wlo1  In  IP 140.82.112.26.443 > 192.168.0.108.57530: Flags [P.], seq 3575:3654, ack 1922, win 68, options [nop,nop,TS val 2808729367 ecr 2638217658], length 79
16:41:17.198075 wlo1  Out IP 192.168.0.108.57530 > 140.82.112.26.443: Flags [.], ack 3654, win 61, options [nop,nop,TS val 2638217931 ecr 2808729367], length 0
16:41:17.208441 wlo1  In  IP 140.82.112.26.443 > 192.168.0.108.57530: Flags [P.], seq 3654:4213, ack 3071, win 71, options [nop,nop,TS val 2808729378 ecr 2638217659], length 559
16:41:17.209897 wlo1  Out IP 192.168.0.108.57530 > 140.82.112.26.443: Flags [P.], seq 3071:3275, ack 4213, win 61, options [nop,nop,TS val 2638217943 ecr 2808729378], length 204
16:41:17.482006 wlo1  In  IP 140.82.112.26.443 > 192.168.0.108.57530: Flags [P.], seq 4213:4286, ack 3275, win 74, options [nop,nop,TS val 2808729652 ecr 2638217943], length 73
16:41:17.522596 wlo1  Out IP 192.168.0.108.57530 > 140.82.112.26.443: Flags [.], ack 4286, win 61, options [nop,nop,TS val 2638218256 ecr 2808729652], length 0
16:41:18.113591 wlo1  Out IP 192.168.0.108.36606 > 163.70.145.60.5222: Flags [P.], seq 572724016:572724085, ack 3835971806, win 56, options [nop,nop,TS val 746043505 ecr 409809685], length 69
16:41:18.137480 wlo1  In  IP 163.70.145.60.5222 > 192.168.0.108.36606: Flags [.], ack 69, win 379, options [nop,nop,TS val 409828788 ecr 746043505], length 0
16:41:18.167435 wlo1  Out IP 192.168.0.108.52223 > 192.168.0.1.53: 58068+ [1au] HTTPS? www-alv.google-analytics.com. (57)
16:41:18.459433 wlo1  In  IP 163.70.145.60.5222 > 192.168.0.108.36606: Flags [P.], seq 1:72, ack 69, win 379, options [nop,nop,TS val 409828999 ecr 746043505], length 71
16:41:18.459576 wlo1  Out IP 192.168.0.108.36606 > 163.70.145.60.5222: Flags [.], ack 72, win 56, options [nop,nop,TS val 746043850 ecr 409828999], length 0
16:41:18.667659 wlo1  Out IP 192.168.0.108.46857 > 192.168.0.1.53: 22998+ [1au] HTTPS? ssl.gstatic.com. (44)
16:41:19.167527 wlo1  Out IP 192.168.0.108.34666 > 192.168.0.1.53: 22164+ [1au] HTTPS? beacons-handoff.gcp.gvt2.com. (57)
16:41:19.594774 lo    In  IP 127.0.0.1.63436 > 127.0.0.53.53: 27770+ HTTPS? www.googleapis.com. (36)
16:41:19.595118 lo    In  IP 127.0.0.1.3642 > 127.0.0.53.53: 50056+ A? www.googleapis.com. (36)
16:41:19.595626 wlo1  Out IP 192.168.0.108.45364 > 192.168.0.1.53: 6842+ [1au] HTTPS? www.googleapis.com. (47)
16:41:19.596211 wlo1  Out IP 192.168.0.108.37910 > 192.168.0.1.53: 38537+ [1au] A? www.googleapis.com. (47)
16:41:19.615201 wlo1  In  IP 192.168.0.1.53 > 192.168.0.108.37910: 38537 16/4/9 A 142.251.223.106, A 142.251.43.170, A 216.58.196.106, A 142.251.223.202, A 216.58.200.170, A 142.250.193.74, A 142.250.182.106, A 172.217.24.234, A 142.250.183.10, A 142.250.193.106, A 172.217.26.106, A 172.217.24.74, A 142.250.183.202, A 172.217.167.234, A 142.250.76.74, A 142.250.192.234 (558)
16:41:19.617660 lo    In  IP 127.0.0.53.53 > 127.0.0.1.3642: 50056 16/4/6 A 142.251.223.106, A 142.251.43.170, A 216.58.196.106, A 142.251.223.202, A 216.58.200.170, A 142.250.193.74, A 142.250.182.106, A 172.217.24.234, A 142.250.183.10, A 142.250.193.106, A 172.217.26.106, A 172.217.24.74, A 142.250.183.202, A 172.217.167.234, A 142.250.76.74, A 142.250.192.234 (491)
16:41:19.625431 wlo1  Out IP 192.168.0.108.34531 > 142.251.223.106.443: UDP, length 1250
16:41:19.625569 wlo1  Out IP 192.168.0.108.34531 > 142.251.223.106.443: UDP, length 1250
16:41:19.625997 wlo1  Out IP 192.168.0.108.34531 > 142.251.223.106.443: UDP, length 80
16:41:19.641755 wlo1  In  IP 142.251.223.106.443 > 192.168.0.108.34531: UDP, length 40
16:41:19.647583 wlo1  In  IP 142.251.223.106.443 > 192.168.0.108.34531: UDP, length 1250
16:41:19.647584 wlo1  In  IP 142.251.223.106.443 > 192.168.0.108.34531: UDP, length 1250
16:41:19.647585 wlo1  In  IP 142.251.223.106.443 > 192.168.0.108.34531: UDP, length 305
16:41:19.647586 wlo1  In  IP 142.251.223.106.443 > 192.168.0.108.34531: UDP, length 945
16:41:19.647586 wlo1  In  IP 142.251.223.106.443 > 192.168.0.108.34531: UDP, length 28
16:41:19.648743 wlo1  Out IP 192.168.0.108.34531 > 142.251.223.106.443: UDP, length 78
16:41:19.649139 wlo1  Out IP 192.168.0.108.34531 > 142.251.223.106.443: UDP, length 31
16:41:19.649857 wlo1  Out IP 192.168.0.108.34531 > 142.251.223.106.443: UDP, length 519
16:41:19.661995 wlo1  In  IP 142.251.223.106.443 > 192.168.0.108.34531: UDP, length 126
16:41:19.662833 wlo1  In  IP 142.251.223.106.443 > 192.168.0.108.34531: UDP, length 29
16:41:19.663400 wlo1  Out IP 192.168.0.108.34531 > 142.251.223.106.443: UDP, length 31
16:41:19.670191 wlo1  In  IP 16.15.191.255.443 > 192.168.0.108.38016: Flags [P.], seq 2796474786:2796474810, ack 1048779637, win 224, options [nop,nop,TS val 1431165148 ecr 3101227700], length 24
16:41:19.670192 wlo1  In  IP 16.15.191.255.443 > 192.168.0.108.38016: Flags [F.], seq 24, ack 1, win 224, options [nop,nop,TS val 1431165148 ecr 3101227700], length 0
16:41:19.710566 wlo1  Out IP 192.168.0.108.38016 > 16.15.191.255.443: Flags [.], ack 25, win 57, options [nop,nop,TS val 3101250976 ecr 1431165148], length 0
16:41:19.740591 wlo1  In  IP 142.251.223.106.443 > 192.168.0.108.34531: UDP, length 1246
16:41:19.743201 wlo1  In  IP 142.251.223.106.443 > 192.168.0.108.34531: UDP, length 1250
16:41:19.743202 wlo1  In  IP 142.251.223.106.443 > 192.168.0.108.34531: UDP, length 1250
16:41:19.743204 wlo1  In  IP 142.251.223.106.443 > 192.168.0.108.34531: UDP, length 1250
16:41:19.743205 wlo1  In  IP 142.251.223.106.443 > 192.168.0.108.34531: UDP, length 1250
16:41:19.743206 wlo1  In  IP 142.251.223.106.443 > 192.168.0.108.34531: UDP, length 1142
16:41:19.743207 wlo1  In  IP 142.251.223.106.443 > 192.168.0.108.34531: UDP, length 229
16:41:19.743444 wlo1  Out IP 192.168.0.108.34531 > 142.251.223.106.443: UDP, length 35
16:41:19.743589 wlo1  Out IP 192.168.0.108.34531 > 142.251.223.106.443: UDP, length 31
16:41:19.743639 wlo1  Out IP 192.168.0.108.34531 > 142.251.223.106.443: UDP, length 31
16:41:19.769636 wlo1  Out IP 192.168.0.108.34531 > 142.251.223.106.443: UDP, length 32
16:41:19.773138 wlo1  Out IP 192.168.0.108.34531 > 142.251.223.106.443: UDP, length 395
16:41:19.781787 wlo1  In  IP 142.251.223.106.443 > 192.168.0.108.34531: UDP, length 24
16:41:19.810818 wlo1  In  IP 142.251.223.106.443 > 192.168.0.108.34531: UDP, length 28
16:41:19.836754 wlo1  Out IP 192.168.0.108.34531 > 142.251.223.106.443: UDP, length 32
16:41:19.906564 wlo1  In  IP 104.18.36.252.443 > 192.168.0.108.54276: Flags [P.], seq 135:269, ack 149, win 18, options [nop,nop,TS val 2408442593 ecr 3037528740], length 134
16:41:19.906873 wlo1  Out IP 192.168.0.108.54276 > 104.18.36.252.443: Flags [P.], seq 149:177, ack 269, win 61, options [nop,nop,TS val 3037543601 ecr 2408442593], length 28
16:41:19.907897 wlo1  Out IP 192.168.0.108.54276 > 104.18.36.252.443: Flags [P.], seq 177:297, ack 269, win 61, options [nop,nop,TS val 3037543602 ecr 2408442593], length 120
16:41:19.921894 wlo1  In  IP 104.18.36.252.443 > 192.168.0.108.54276: Flags [.], ack 177, win 18, options [nop,nop,TS val 2408442613 ecr 3037543601], length 0
16:41:19.923153 wlo1  In  IP 104.18.36.252.443 > 192.168.0.108.54276: Flags [.], ack 297, win 18, options [nop,nop,TS val 2408442614 ecr 3037543602], length 0
16:41:19.988127 wlo1  In  IP 142.251.223.106.443 > 192.168.0.108.34531: UDP, length 1246
16:41:19.988129 wlo1  In  IP 142.251.223.106.443 > 192.168.0.108.34531: UDP, length 1250
16:41:19.988130 wlo1  In  IP 142.251.223.106.443 > 192.168.0.108.34531: UDP, length 1250
16:41:19.988131 wlo1  In  IP 142.251.223.106.443 > 192.168.0.108.34531: UDP, length 1250
16:41:19.988132 wlo1  In  IP 142.251.223.106.443 > 192.168.0.108.34531: UDP, length 1250
16:41:19.988133 wlo1  In  IP 142.251.223.106.443 > 192.168.0.108.34531: UDP, length 1250
16:41:19.988134 wlo1  In  IP 142.251.223.106.443 > 192.168.0.108.34531: UDP, length 1250
16:41:19.988135 wlo1  In  IP 142.251.223.106.443 > 192.168.0.108.34531: UDP, length 1250
16:41:19.988274 wlo1  In  IP 142.251.223.106.443 > 192.168.0.108.34531: UDP, length 1250
16:41:19.988275 wlo1  In  IP 142.251.223.106.443 > 192.168.0.108.34531: UDP, length 1250
16:41:19.988696 wlo1  In  IP 142.251.223.106.443 > 192.168.0.108.34531: UDP, length 1250
16:41:19.988698 wlo1  In  IP 142.251.223.106.443 > 192.168.0.108.34531: UDP, length 1250
16:41:19.988699 wlo1  In  IP 142.251.223.106.443 > 192.168.0.108.34531: UDP, length 646
16:41:19.988701 wlo1  In  IP 142.251.223.106.443 > 192.168.0.108.34531: UDP, length 1245
16:41:19.988702 wlo1  In  IP 142.251.223.106.443 > 192.168.0.108.34531: UDP, length 1250
16:41:19.988703 wlo1  In  IP 142.251.223.106.443 > 192.168.0.108.34531: UDP, length 1250
16:41:19.988704 wlo1  In  IP 142.251.223.106.443 > 192.168.0.108.34531: UDP, length 1250
16:41:19.988705 wlo1  In  IP 142.251.223.106.443 > 192.168.0.108.34531: UDP, length 1250
16:41:19.988720 wlo1  Out IP 192.168.0.108.34531 > 142.251.223.106.443: UDP, length 35
16:41:19.988784 wlo1  In  IP 142.251.223.106.443 > 192.168.0.108.34531: UDP, length 1250
16:41:19.988786 wlo1  In  IP 142.251.223.106.443 > 192.168.0.108.34531: UDP, length 1250
16:41:19.988787 wlo1  In  IP 142.251.223.106.443 > 192.168.0.108.34531: UDP, length 1250
16:41:19.988788 wlo1  In  IP 142.251.223.106.443 > 192.168.0.108.34531: UDP, length 1250
16:41:19.988789 wlo1  In  IP 142.251.223.106.443 > 192.168.0.108.34531: UDP, length 1250
16:41:19.988851 wlo1  Out IP 192.168.0.108.34531 > 142.251.223.106.443: UDP, length 31
16:41:19.988900 wlo1  Out IP 192.168.0.108.34531 > 142.251.223.106.443: UDP, length 31
16:41:19.988955 wlo1  Out IP 192.168.0.108.34531 > 142.251.223.106.443: UDP, length 31
16:41:19.989003 wlo1  Out IP 192.168.0.108.34531 > 142.251.223.106.443: UDP, length 31
16:41:19.989044 wlo1  Out IP 192.168.0.108.34531 > 142.251.223.106.443: UDP, length 31
16:41:19.989120 wlo1  Out IP 192.168.0.108.34531 > 142.251.223.106.443: UDP, length 31
16:41:19.989162 wlo1  Out IP 192.168.0.108.34531 > 142.251.223.106.443: UDP, length 31
16:41:19.989203 wlo1  Out IP 192.168.0.108.34531 > 142.251.223.106.443: UDP, length 31
16:41:19.989244 wlo1  Out IP 192.168.0.108.34531 > 142.251.223.106.443: UDP, length 31
16:41:19.989296 wlo1  Out IP 192.168.0.108.34531 > 142.251.223.106.443: UDP, length 31
16:41:19.990771 wlo1  In  IP 142.251.223.106.443 > 192.168.0.108.34531: UDP, length 1250
16:41:19.991519 wlo1  In  IP 142.251.223.106.443 > 192.168.0.108.34531: UDP, length 1250
16:41:19.991520 wlo1  In  IP 142.251.223.106.443 > 192.168.0.108.34531: UDP, length 1250
16:41:19.991521 wlo1  In  IP 142.251.223.106.443 > 192.168.0.108.34531: UDP, length 1250
16:41:19.991716 wlo1  Out IP 192.168.0.108.34531 > 142.251.223.106.443: UDP, length 31
16:41:19.991785 wlo1  Out IP 192.168.0.108.34531 > 142.251.223.106.443: UDP, length 31
16:41:19.996310 wlo1  In  IP 142.251.223.106.443 > 192.168.0.108.34531: UDP, length 1250
16:41:19.996312 wlo1  In  IP 142.251.223.106.443 > 192.168.0.108.34531: UDP, length 1250
16:41:19.996313 wlo1  In  IP 142.251.223.106.443 > 192.168.0.108.34531: UDP, length 1250
16:41:19.996314 wlo1  In  IP 142.251.223.106.443 > 192.168.0.108.34531: UDP, length 1250
16:41:19.996314 wlo1  In  IP 142.251.223.106.443 > 192.168.0.108.34531: UDP, length 1250
16:41:19.996316 wlo1  In  IP 142.251.223.106.443 > 192.168.0.108.34531: UDP, length 1250
16:41:19.996317 wlo1  In  IP 142.251.223.106.443 > 192.168.0.108.34531: UDP, length 1250
16:41:19.996318 wlo1  In  IP 142.251.223.106.443 > 192.168.0.108.34531: UDP, length 1250
16:41:19.996605 wlo1  Out IP 192.168.0.108.34531 > 142.251.223.106.443: UDP, length 31
16:41:19.996697 wlo1  Out IP 192.168.0.108.34531 > 142.251.223.106.443: UDP, length 31
16:41:19.996733 wlo1  Out IP 192.168.0.108.34531 > 142.251.223.106.443: UDP, length 31
16:41:19.996772 wlo1  Out IP 192.168.0.108.34531 > 142.251.223.106.443: UDP, length 31
16:41:19.999005 wlo1  In  IP 142.251.223.106.443 > 192.168.0.108.34531: UDP, length 1250
16:41:19.999006 wlo1  In  IP 142.251.223.106.443 > 192.168.0.108.34531: UDP, length 1250
16:41:19.999007 wlo1  In  IP 142.251.223.106.443 > 192.168.0.108.34531: UDP, length 1250
16:41:19.999008 wlo1  In  IP 142.251.223.106.443 > 192.168.0.108.34531: UDP, length 1250
16:41:19.999166 wlo1  Out IP 192.168.0.108.34531 > 142.251.223.106.443: UDP, length 31
16:41:19.999232 wlo1  Out IP 192.168.0.108.34531 > 142.251.223.106.443: UDP, length 31
16:41:19.999828 wlo1  In  IP 142.251.223.106.443 > 192.168.0.108.34531: UDP, length 1250
16:41:19.999829 wlo1  In  IP 142.251.223.106.443 > 192.168.0.108.34531: UDP, length 1250
16:41:19.999830 wlo1  In  IP 142.251.223.106.443 > 192.168.0.108.34531: UDP, length 1250
16:41:19.999831 wlo1  In  IP 142.251.223.106.443 > 192.168.0.108.34531: UDP, length 1250
16:41:19.999971 wlo1  Out IP 192.168.0.108.34531 > 142.251.223.106.443: UDP, length 31
16:41:20.000038 wlo1  Out IP 192.168.0.108.34531 > 142.251.223.106.443: UDP, length 36
16:41:20.000939 wlo1  In  IP 142.251.223.106.443 > 192.168.0.108.34531: UDP, length 1250
16:41:20.001030 wlo1  Out IP 192.168.0.108.34531 > 142.251.223.106.443: UDP, length 31
16:41:20.001379 wlo1  In  IP 142.251.223.106.443 > 192.168.0.108.34531: UDP, length 1250
16:41:20.001380 wlo1  In  IP 142.251.223.106.443 > 192.168.0.108.34531: UDP, length 1250
16:41:20.001434 wlo1  Out IP 192.168.0.108.34531 > 142.251.223.106.443: UDP, length 32
16:41:20.002697 wlo1  In  IP 142.251.223.106.443 > 192.168.0.108.34531: UDP, length 1250
16:41:20.002698 wlo1  In  IP 142.251.223.106.443 > 192.168.0.108.34531: UDP, length 1250
16:41:20.002751 wlo1  Out IP 192.168.0.108.34531 > 142.251.223.106.443: UDP, length 32
16:41:20.003342 wlo1  In  IP 142.251.223.106.443 > 192.168.0.108.34531: UDP, length 537
16:41:20.029033 wlo1  Out IP 192.168.0.108.34531 > 142.251.223.106.443: UDP, length 33
16:41:20.040132 wlo1  In  IP 142.251.223.106.443 > 192.168.0.108.34531: UDP, length 25
16:41:20.182702 wlo1  Out IP 192.168.0.108.34531 > 142.251.223.106.443: UDP, length 739
16:41:20.224826 wlo1  In  IP 142.251.223.106.443 > 192.168.0.108.34531: UDP, length 29
16:41:20.251748 wlo1  Out IP 192.168.0.108.34531 > 142.251.223.106.443: UDP, length 33
16:41:20.815847 wlo1  In  IP 142.251.223.106.443 > 192.168.0.108.34531: UDP, length 1246
16:41:20.815849 wlo1  In  IP 142.251.223.106.443 > 192.168.0.108.34531: UDP, length 1250
16:41:20.815850 wlo1  In  IP 142.251.223.106.443 > 192.168.0.108.34531: UDP, length 1250
16:41:20.815851 wlo1  In  IP 142.251.223.106.443 > 192.168.0.108.34531: UDP, length 1250
16:41:20.815851 wlo1  In  IP 142.251.223.106.443 > 192.168.0.108.34531: UDP, length 1250
16:41:20.815852 wlo1  In  IP 142.251.223.106.443 > 192.168.0.108.34531: UDP, length 1250
16:41:20.815852 wlo1  In  IP 142.251.223.106.443 > 192.168.0.108.34531: UDP, length 1250
16:41:20.815853 wlo1  In  IP 142.251.223.106.443 > 192.168.0.108.34531: UDP, length 1250
16:41:20.815951 wlo1  In  IP 142.251.223.106.443 > 192.168.0.108.34531: UDP, length 1250
16:41:20.815952 wlo1  In  IP 142.251.223.106.443 > 192.168.0.108.34531: UDP, length 1250
16:41:20.815952 wlo1  In  IP 142.251.223.106.443 > 192.168.0.108.34531: UDP, length 1250
16:41:20.815953 wlo1  In  IP 142.251.223.106.443 > 192.168.0.108.34531: UDP, length 1250
16:41:20.815954 wlo1  In  IP 142.251.223.106.443 > 192.168.0.108.34531: UDP, length 260
16:41:20.815955 wlo1  In  IP 142.251.223.106.443 > 192.168.0.108.34531: UDP, length 445
16:41:20.815956 wlo1  In  IP 142.251.223.106.443 > 192.168.0.108.34531: UDP, length 1245
16:41:20.815956 wlo1  In  IP 142.251.223.106.443 > 192.168.0.108.34531: UDP, length 1250
16:41:20.815993 wlo1  In  IP 142.251.223.106.443 > 192.168.0.108.34531: UDP, length 1250
16:41:20.815994 wlo1  In  IP 142.251.223.106.443 > 192.168.0.108.34531: UDP, length 1250
16:41:20.815995 wlo1  In  IP 142.251.223.106.443 > 192.168.0.108.34531: UDP, length 1250
16:41:20.815996 wlo1  In  IP 142.251.223.106.443 > 192.168.0.108.34531: UDP, length 1250
16:41:20.815996 wlo1  In  IP 142.251.223.106.443 > 192.168.0.108.34531: UDP, length 1250
16:41:20.816173 wlo1  In  IP 142.251.223.106.443 > 192.168.0.108.34531: UDP, length 1250
16:41:20.816174 wlo1  In  IP 142.251.223.106.443 > 192.168.0.108.34531: UDP, length 1250
16:41:20.817114 wlo1  Out IP 192.168.0.108.34531 > 142.251.223.106.443: UDP, length 36
16:41:20.817362 wlo1  Out IP 192.168.0.108.34531 > 142.251.223.106.443: UDP, length 32
16:41:20.817397 wlo1  Out IP 192.168.0.108.34531 > 142.251.223.106.443: UDP, length 32
16:41:20.817473 wlo1  Out IP 192.168.0.108.34531 > 142.251.223.106.443: UDP, length 32
16:41:20.817509 wlo1  Out IP 192.168.0.108.34531 > 142.251.223.106.443: UDP, length 32
16:41:20.817587 wlo1  Out IP 192.168.0.108.34531 > 142.251.223.106.443: UDP, length 32
16:41:20.817673 wlo1  Out IP 192.168.0.108.34531 > 142.251.223.106.443: UDP, length 32
16:41:20.817716 wlo1  Out IP 192.168.0.108.34531 > 142.251.223.106.443: UDP, length 32
16:41:20.817751 wlo1  Out IP 192.168.0.108.34531 > 142.251.223.106.443: UDP, length 32
16:41:20.817777 wlo1  Out IP 192.168.0.108.34531 > 142.251.223.106.443: UDP, length 32
16:41:20.817811 wlo1  Out IP 192.168.0.108.34531 > 142.251.223.106.443: UDP, length 32
16:41:20.818523 wlo1  In  IP 142.251.223.106.443 > 192.168.0.108.34531: UDP, length 1250
16:41:20.818525 wlo1  In  IP 142.251.223.106.443 > 192.168.0.108.34531: UDP, length 1250
16:41:20.818525 wlo1  In  IP 142.251.223.106.443 > 192.168.0.108.34531: UDP, length 1250
16:41:20.818526 wlo1  In  IP 142.251.223.106.443 > 192.168.0.108.34531: UDP, length 1250
16:41:20.818526 wlo1  In  IP 142.251.223.106.443 > 192.168.0.108.34531: UDP, length 492
16:41:20.818527 wlo1  In  IP 142.251.223.106.443 > 192.168.0.108.34531: UDP, length 1243
16:41:20.818527 wlo1  In  IP 142.251.223.106.443 > 192.168.0.108.34531: UDP, length 1250
16:41:20.818529 wlo1  In  IP 142.251.223.106.443 > 192.168.0.108.34531: UDP, length 1250
16:41:20.819297 wlo1  Out IP 192.168.0.108.34531 > 142.251.223.106.443: UDP, length 32
16:41:20.819340 wlo1  Out IP 192.168.0.108.34531 > 142.251.223.106.443: UDP, length 32
16:41:20.819365 wlo1  Out IP 192.168.0.108.34531 > 142.251.223.106.443: UDP, length 32
16:41:20.819395 wlo1  Out IP 192.168.0.108.34531 > 142.251.223.106.443: UDP, length 32
16:41:20.823094 wlo1  In  IP 142.251.223.106.443 > 192.168.0.108.34531: UDP, length 1250
16:41:20.823095 wlo1  In  IP 142.251.223.106.443 > 192.168.0.108.34531: UDP, length 1250
16:41:20.823096 wlo1  In  IP 142.251.223.106.443 > 192.168.0.108.34531: UDP, length 1250
16:41:20.823097 wlo1  In  IP 142.251.223.106.443 > 192.168.0.108.34531: UDP, length 1250
16:41:20.823097 wlo1  In  IP 142.251.223.106.443 > 192.168.0.108.34531: UDP, length 1250
16:41:20.823098 wlo1  In  IP 142.251.223.106.443 > 192.168.0.108.34531: UDP, length 1250
16:41:20.823098 wlo1  In  IP 142.251.223.106.443 > 192.168.0.108.34531: UDP, length 1250
16:41:20.823099 wlo1  In  IP 142.251.223.106.443 > 192.168.0.108.34531: UDP, length 1250
16:41:20.823152 wlo1  In  IP 142.251.223.106.443 > 192.168.0.108.34531: UDP, length 1250
16:41:20.823153 wlo1  In  IP 142.251.223.106.443 > 192.168.0.108.34531: UDP, length 1250
16:41:20.823154 wlo1  In  IP 142.251.223.106.443 > 192.168.0.108.34531: UDP, length 496
16:41:20.823154 wlo1  In  IP 142.251.223.106.443 > 192.168.0.108.34531: UDP, length 1243
16:41:20.823155 wlo1  In  IP 142.251.223.106.443 > 192.168.0.108.34531: UDP, length 1250
16:41:20.823156 wlo1  In  IP 142.251.223.106.443 > 192.168.0.108.34531: UDP, length 1250
16:41:20.823157 wlo1  In  IP 142.251.223.106.443 > 192.168.0.108.34531: UDP, length 1250
16:41:20.823157 wlo1  In  IP 142.251.223.106.443 > 192.168.0.108.34531: UDP, length 1250
16:41:20.823194 wlo1  In  IP 142.251.223.106.443 > 192.168.0.108.34531: UDP, length 1250
16:41:20.823194 wlo1  In  IP 142.251.223.106.443 > 192.168.0.108.34531: UDP, length 1250
16:41:20.823195 wlo1  In  IP 142.251.223.106.443 > 192.168.0.108.34531: UDP, length 1250
16:41:20.823195 wlo1  In  IP 142.251.223.106.443 > 192.168.0.108.34531: UDP, length 1250
16:41:20.823196 wlo1  In  IP 142.251.223.106.443 > 192.168.0.108.34531: UDP, length 1250
16:41:20.823197 wlo1  In  IP 142.251.223.106.443 > 192.168.0.108.34531: UDP, length 1250
16:41:20.823197 wlo1  In  IP 142.251.223.106.443 > 192.168.0.108.34531: UDP, length 1250
16:41:20.823198 wlo1  In  IP 142.251.223.106.443 > 192.168.0.108.34531: UDP, length 1185
16:41:20.823228 wlo1  In  IP 142.251.223.106.443 > 192.168.0.108.34531: UDP, length 1246
16:41:20.823228 wlo1  In  IP 142.251.223.106.443 > 192.168.0.108.34531: UDP, length 550
16:41:20.823356 wlo1  Out IP 192.168.0.108.34531 > 142.251.223.106.443: UDP, length 32
16:41:20.823452 wlo1  Out IP 192.168.0.108.34531 > 142.251.223.106.443: UDP, length 32
16:41:20.823628 wlo1  Out IP 192.168.0.108.34531 > 142.251.223.106.443: UDP, length 32
16:41:20.823759 wlo1  Out IP 192.168.0.108.34531 > 142.251.223.106.443: UDP, length 32
16:41:20.823795 wlo1  Out IP 192.168.0.108.34531 > 142.251.223.106.443: UDP, length 34
16:41:20.823824 wlo1  Out IP 192.168.0.108.34531 > 142.251.223.106.443: UDP, length 39
16:41:20.827308 wlo1  In  IP 142.251.223.106.443 > 192.168.0.108.34531: UDP, length 1243
16:41:20.827309 wlo1  In  IP 142.251.223.106.443 > 192.168.0.108.34531: UDP, length 1250
16:41:20.827310 wlo1  In  IP 142.251.223.106.443 > 192.168.0.108.34531: UDP, length 1250
16:41:20.827310 wlo1  In  IP 142.251.223.106.443 > 192.168.0.108.34531: UDP, length 1250
16:41:20.827311 wlo1  In  IP 142.251.223.106.443 > 192.168.0.108.34531: UDP, length 1250
16:41:20.827311 wlo1  In  IP 142.251.223.106.443 > 192.168.0.108.34531: UDP, length 1250
16:41:20.827312 wlo1  In  IP 142.251.223.106.443 > 192.168.0.108.34531: UDP, length 1250
16:41:20.827313 wlo1  In  IP 142.251.223.106.443 > 192.168.0.108.34531: UDP, length 1250
16:41:20.827368 wlo1  In  IP 142.251.223.106.443 > 192.168.0.108.34531: UDP, length 1250
16:41:20.827369 wlo1  In  IP 142.251.223.106.443 > 192.168.0.108.34531: UDP, length 1250
16:41:20.827370 wlo1  In  IP 142.251.223.106.443 > 192.168.0.108.34531: UDP, length 1250
16:41:20.827371 wlo1  In  IP 142.251.223.106.443 > 192.168.0.108.34531: UDP, length 1250
16:41:20.827371 wlo1  In  IP 142.251.223.106.443 > 192.168.0.108.34531: UDP, length 1250
16:41:20.827372 wlo1  In  IP 142.251.223.106.443 > 192.168.0.108.34531: UDP, length 496
16:41:20.827372 wlo1  In  IP 142.251.223.106.443 > 192.168.0.108.34531: UDP, length 1243
16:41:20.827520 wlo1  Out IP 192.168.0.108.34531 > 142.251.223.106.443: UDP, length 34
16:41:20.827586 wlo1  Out IP 192.168.0.108.34531 > 142.251.223.106.443: UDP, length 34
16:41:20.827677 wlo1  Out IP 192.168.0.108.34531 > 142.251.223.106.443: UDP, length 34
16:41:20.828795 wlo1  In  IP 142.251.223.106.443 > 192.168.0.108.34531: UDP, length 1250
16:41:20.828796 wlo1  In  IP 142.251.223.106.443 > 192.168.0.108.34531: UDP, length 1250
16:41:20.828797 wlo1  In  IP 142.251.223.106.443 > 192.168.0.108.34531: UDP, length 1250
16:41:20.828798 wlo1  In  IP 142.251.223.106.443 > 192.168.0.108.34531: UDP, length 1250
16:41:20.828798 wlo1  In  IP 142.251.223.106.443 > 192.168.0.108.34531: UDP, length 1250
16:41:20.831604 wlo1  Out IP 192.168.0.108.34531 > 142.251.223.106.443: UDP, length 35
16:41:20.832092 wlo1  In  IP 142.251.223.106.443 > 192.168.0.108.34531: UDP, length 1250
16:41:20.832093 wlo1  In  IP 142.251.223.106.443 > 192.168.0.108.34531: UDP, length 1250
16:41:20.832094 wlo1  In  IP 142.251.223.106.443 > 192.168.0.108.34531: UDP, length 1250
16:41:20.832095 wlo1  In  IP 142.251.223.106.443 > 192.168.0.108.34531: UDP, length 1250
16:41:20.832613 wlo1  Out IP 192.168.0.108.34531 > 142.251.223.106.443: UDP, length 36
16:41:20.832694 wlo1  Out IP 192.168.0.108.34531 > 142.251.223.106.443: UDP, length 36
16:41:20.832890 wlo1  In  IP 142.251.223.106.443 > 192.168.0.108.34531: UDP, length 1250
16:41:20.832891 wlo1  In  IP 142.251.223.106.443 > 192.168.0.108.34531: UDP, length 1250
16:41:20.832892 wlo1  In  IP 142.251.223.106.443 > 192.168.0.108.34531: UDP, length 1250
16:41:20.832893 wlo1  In  IP 142.251.223.106.443 > 192.168.0.108.34531: UDP, length 1250
16:41:20.832894 wlo1  In  IP 142.251.223.106.443 > 192.168.0.108.34531: UDP, length 1250
16:41:20.832956 wlo1  Out IP 192.168.0.108.34531 > 142.251.223.106.443: UDP, length 36
16:41:20.833000 wlo1  Out IP 192.168.0.108.34531 > 142.251.223.106.443: UDP, length 36
16:41:20.834748 wlo1  In  IP 142.251.223.106.443 > 192.168.0.108.34531: UDP, length 1250
16:41:20.834749 wlo1  In  IP 142.251.223.106.443 > 192.168.0.108.34531: UDP, length 1250
16:41:20.834750 wlo1  In  IP 142.251.223.106.443 > 192.168.0.108.34531: UDP, length 1250
16:41:20.835518 wlo1  In  IP 142.251.223.106.443 > 192.168.0.108.34531: UDP, length 1250
16:41:20.835519 wlo1  In  IP 142.251.223.106.443 > 192.168.0.108.34531: UDP, length 1250
16:41:20.835519 wlo1  In  IP 142.251.223.106.443 > 192.168.0.108.34531: UDP, length 1250
16:41:20.835520 wlo1  In  IP 142.251.223.106.443 > 192.168.0.108.34531: UDP, length 1250
16:41:20.835521 wlo1  In  IP 142.251.223.106.443 > 192.168.0.108.34531: UDP, length 1250
16:41:20.835785 wlo1  Out IP 192.168.0.108.34531 > 142.251.223.106.443: UDP, length 36
16:41:20.836441 wlo1  In  IP 142.251.223.106.443 > 192.168.0.108.34531: UDP, length 1250
16:41:20.836443 wlo1  In  IP 142.251.223.106.443 > 192.168.0.108.34531: UDP, length 1250
16:41:20.836444 wlo1  In  IP 142.251.223.106.443 > 192.168.0.108.34531: UDP, length 1250
16:41:20.836444 wlo1  In  IP 142.251.223.106.443 > 192.168.0.108.34531: UDP, length 1250
16:41:20.836445 wlo1  In  IP 142.251.223.106.443 > 192.168.0.108.34531: UDP, length 1250
16:41:20.836446 wlo1  In  IP 142.251.223.106.443 > 192.168.0.108.34531: UDP, length 1250
16:41:20.836990 wlo1  In  IP 142.251.223.106.443 > 192.168.0.108.34531: UDP, length 1250
16:41:20.836992 wlo1  In  IP 142.251.223.106.443 > 192.168.0.108.34531: UDP, length 1250
16:41:20.836992 wlo1  In  IP 142.251.223.106.443 > 192.168.0.108.34531: UDP, length 1250
16:41:20.836993 wlo1  In  IP 142.251.223.106.443 > 192.168.0.108.34531: UDP, length 1250
16:41:20.837193 wlo1  Out IP 192.168.0.108.34531 > 142.251.223.106.443: UDP, length 36
16:41:20.837483 wlo1  In  IP 142.251.223.106.443 > 192.168.0.108.34531: UDP, length 1250
16:41:20.837484 wlo1  In  IP 142.251.223.106.443 > 192.168.0.108.34531: UDP, length 1250
16:41:20.840852 wlo1  Out IP 192.168.0.108.34531 > 142.251.223.106.443: UDP, length 37
16:41:20.864642 wlo1  In  IP 142.251.223.106.443 > 192.168.0.108.34531: UDP, length 26
16:41:21.167437 wlo1  Out IP 192.168.0.108.57158 > 192.168.0.1.53: 14812+ [1au] HTTPS? live.github.com. (44)
16:41:21.246982 wlo1  Out IP 192.168.0.108.34531 > 142.251.223.106.443: UDP, length 1220
16:41:21.308430 wlo1  Out IP 192.168.0.108.34531 > 142.251.223.106.443: UDP, length 1220
16:41:21.430954 wlo1  Out IP 192.168.0.108.34531 > 142.251.223.106.443: UDP, length 1220
16:41:21.459977 wlo1  In  ARP, Request who-has 192.168.0.108 tell 192.168.0.1, length 28
16:41:21.460001 wlo1  Out ARP, Reply 192.168.0.108 is-at 4a:2c:10:c6:25:3e, length 28
16:41:21.460314 wlo1  In  IP 142.251.223.106.443 > 192.168.0.108.34531: UDP, length 30
16:41:21.460316 wlo1  In  IP 142.251.223.106.443 > 192.168.0.108.34531: UDP, length 27
16:41:21.464321 wlo1  Out IP 192.168.0.108.34531 > 142.251.223.106.443: UDP, length 33
16:41:21.469494 wlo1  In  IP 142.251.223.106.443 > 192.168.0.108.34531: UDP, length 29
16:41:21.667525 wlo1  Out IP 192.168.0.108.43052 > 192.168.0.1.53: 38072+ [1au] HTTPS? collector.quillbot.com. (51)
16:41:21.667684 wlo1  Out IP 192.168.0.108.55169 > 192.168.0.1.53: 12045+ [1au] HTTPS? api2.amplitude.com. (47)
16:41:21.753931 wlo1  In  IP 142.251.223.106.443 > 192.168.0.108.34531: UDP, length 1246
16:41:21.754603 wlo1  In  IP 142.251.223.106.443 > 192.168.0.108.34531: UDP, length 1250
16:41:21.754605 wlo1  In  IP 142.251.223.106.443 > 192.168.0.108.34531: UDP, length 1250
16:41:21.754606 wlo1  In  IP 142.251.223.106.443 > 192.168.0.108.34531: UDP, length 1250
16:41:21.754606 wlo1  In  IP 142.251.223.106.443 > 192.168.0.108.34531: UDP, length 1250
16:41:21.755504 wlo1  In  IP 142.251.223.106.443 > 192.168.0.108.34531: UDP, length 1250
16:41:21.755505 wlo1  In  IP 142.251.223.106.443 > 192.168.0.108.34531: UDP, length 1250
16:41:21.755506 wlo1  In  IP 142.251.223.106.443 > 192.168.0.108.34531: UDP, length 1250
16:41:21.755507 wlo1  In  IP 142.251.223.106.443 > 192.168.0.108.34531: UDP, length 1250
16:41:21.755507 wlo1  In  IP 142.251.223.106.443 > 192.168.0.108.34531: UDP, length 1250
16:41:21.755508 wlo1  In  IP 142.251.223.106.443 > 192.168.0.108.34531: UDP, length 1250
16:41:21.755857 wlo1  Out IP 192.168.0.108.34531 > 142.251.223.106.443: UDP, length 36
16:41:21.756417 wlo1  In  IP 142.251.223.106.443 > 192.168.0.108.34531: UDP, length 1250
16:41:21.756418 wlo1  In  IP 142.251.223.106.443 > 192.168.0.108.34531: UDP, length 261
16:41:21.756418 wlo1  In  IP 142.251.223.106.443 > 192.168.0.108.34531: UDP, length 445
16:41:21.756419 wlo1  In  IP 142.251.223.106.443 > 192.168.0.108.34531: UDP, length 1245
16:41:21.756420 wlo1  In  IP 142.251.223.106.443 > 192.168.0.108.34531: UDP, length 1250
16:41:21.756420 wlo1  In  IP 142.251.223.106.443 > 192.168.0.108.34531: UDP, length 1250
16:41:21.756421 wlo1  In  IP 142.251.223.106.443 > 192.168.0.108.34531: UDP, length 1250
16:41:21.756422 wlo1  In  IP 142.251.223.106.443 > 192.168.0.108.34531: UDP, length 1250
16:41:21.757329 wlo1  In  IP 142.251.223.106.443 > 192.168.0.108.34531: UDP, length 1250
16:41:21.757330 wlo1  In  IP 142.251.223.106.443 > 192.168.0.108.34531: UDP, length 1250
16:41:21.757331 wlo1  In  IP 142.251.223.106.443 > 192.168.0.108.34531: UDP, length 1250
16:41:21.757331 wlo1  In  IP 142.251.223.106.443 > 192.168.0.108.34531: UDP, length 1250
16:41:21.757332 wlo1  In  IP 142.251.223.106.443 > 192.168.0.108.34531: UDP, length 1250
16:41:21.757453 wlo1  Out IP 192.168.0.108.34531 > 142.251.223.106.443: UDP, length 32
16:41:21.757704 wlo1  In  IP 142.251.223.106.443 > 192.168.0.108.34531: UDP, length 1250
16:41:21.757705 wlo1  In  IP 142.251.223.106.443 > 192.168.0.108.34531: UDP, length 1250
16:41:21.758078 wlo1  In  IP 142.251.223.106.443 > 192.168.0.108.34531: UDP, length 1250
16:41:21.758606 wlo1  In  IP 142.251.223.106.443 > 192.168.0.108.34531: UDP, length 1250
16:41:21.758607 wlo1  In  IP 142.251.223.106.443 > 192.168.0.108.34531: UDP, length 1250
16:41:21.758607 wlo1  In  IP 142.251.223.106.443 > 192.168.0.108.34531: UDP, length 1250
16:41:21.758688 wlo1  Out IP 192.168.0.108.34531 > 142.251.223.106.443: UDP, length 32
16:41:21.759310 wlo1  In  IP 142.251.223.106.443 > 192.168.0.108.34531: UDP, length 1250
16:41:21.759311 wlo1  In  IP 142.251.223.106.443 > 192.168.0.108.34531: UDP, length 1250
16:41:21.759312 wlo1  In  IP 142.251.223.106.443 > 192.168.0.108.34531: UDP, length 1250
16:41:21.759312 wlo1  In  IP 142.251.223.106.443 > 192.168.0.108.34531: UDP, length 1250
16:41:21.760232 wlo1  In  IP 142.251.223.106.443 > 192.168.0.108.34531: UDP, length 1250
16:41:21.760233 wlo1  In  IP 142.251.223.106.443 > 192.168.0.108.34531: UDP, length 1250
16:41:21.760926 wlo1  In  IP 142.251.223.106.443 > 192.168.0.108.34531: UDP, length 1250
16:41:21.760928 wlo1  In  IP 142.251.223.106.443 > 192.168.0.108.34531: UDP, length 1250
16:41:21.760929 wlo1  In  IP 142.251.223.106.443 > 192.168.0.108.34531: UDP, length 1250
16:41:21.760930 wlo1  In  IP 142.251.223.106.443 > 192.168.0.108.34531: UDP, length 1250
16:41:21.761145 wlo1  Out IP 192.168.0.108.34531 > 142.251.223.106.443: UDP, length 32
16:41:21.761916 wlo1  In  IP 142.251.223.106.443 > 192.168.0.108.34531: UDP, length 951
16:41:21.761917 wlo1  In  IP 142.251.223.106.443 > 192.168.0.108.34531: UDP, length 1243
16:41:21.761918 wlo1  In  IP 142.251.223.106.443 > 192.168.0.108.34531: UDP, length 1250
16:41:21.761919 wlo1  In  IP 142.251.223.106.443 > 192.168.0.108.34531: UDP, length 1250
16:41:21.761920 wlo1  In  IP 142.251.223.106.443 > 192.168.0.108.34531: UDP, length 1250
16:41:21.761921 wlo1  In  IP 142.251.223.106.443 > 192.168.0.108.34531: UDP, length 1250
16:41:21.762158 wlo1  In  IP 142.251.223.106.443 > 192.168.0.108.34531: UDP, length 1250
16:41:21.762160 wlo1  In  IP 142.251.223.106.443 > 192.168.0.108.34531: UDP, length 1250
16:41:21.762674 wlo1  In  IP 142.251.223.106.443 > 192.168.0.108.34531: UDP, length 1250
16:41:21.762675 wlo1  In  IP 142.251.223.106.443 > 192.168.0.108.34531: UDP, length 1250
16:41:21.762677 wlo1  In  IP 142.251.223.106.443 > 192.168.0.108.34531: UDP, length 1250
16:41:21.762798 wlo1  Out IP 192.168.0.108.34531 > 142.251.223.106.443: UDP, length 32
16:41:21.763453 wlo1  In  IP 142.251.223.106.443 > 192.168.0.108.34531: UDP, length 1250
16:41:21.763454 wlo1  In  IP 142.251.223.106.443 > 192.168.0.108.34531: UDP, length 1250
16:41:21.763455 wlo1  In  IP 142.251.223.106.443 > 192.168.0.108.34531: UDP, length 1185
16:41:21.766194 wlo1  Out IP 192.168.0.108.34531 > 142.251.223.106.443: UDP, length 33
16:41:21.938756 wlo1  Out IP 192.168.0.108.34531 > 142.251.223.106.443: UDP, length 30
16:41:21.957004 wlo1  In  IP 142.251.223.106.443 > 192.168.0.108.34531: UDP, length 26
16:41:21.957007 wlo1  In  IP 142.251.223.106.443 > 192.168.0.108.34531: UDP, length 550
16:41:21.957008 wlo1  In  IP 142.251.223.106.443 > 192.168.0.108.34531: UDP, length 1243
16:41:21.957010 wlo1  In  IP 142.251.223.106.443 > 192.168.0.108.34531: UDP, length 1250
16:41:21.957010 wlo1  In  IP 142.251.223.106.443 > 192.168.0.108.34531: UDP, length 1250
16:41:21.957011 wlo1  In  IP 142.251.223.106.443 > 192.168.0.108.34531: UDP, length 1250
16:41:21.957012 wlo1  In  IP 142.251.223.106.443 > 192.168.0.108.34531: UDP, length 1250
16:41:21.957013 wlo1  In  IP 142.251.223.106.443 > 192.168.0.108.34531: UDP, length 1250
16:41:21.959893 wlo1  In  IP 142.251.223.106.443 > 192.168.0.108.34531: UDP, length 1250
16:41:21.959895 wlo1  In  IP 142.251.223.106.443 > 192.168.0.108.34531: UDP, length 1250
16:41:21.959895 wlo1  In  IP 142.251.223.106.443 > 192.168.0.108.34531: UDP, length 1250
16:41:21.959896 wlo1  In  IP 142.251.223.106.443 > 192.168.0.108.34531: UDP, length 1250
16:41:21.959897 wlo1  In  IP 142.251.223.106.443 > 192.168.0.108.34531: UDP, length 1250
16:41:21.959898 wlo1  In  IP 142.251.223.106.443 > 192.168.0.108.34531: UDP, length 1250
16:41:21.959898 wlo1  In  IP 142.251.223.106.443 > 192.168.0.108.34531: UDP, length 1250
16:41:21.959899 wlo1  In  IP 142.251.223.106.443 > 192.168.0.108.34531: UDP, length 1250
16:41:21.959993 wlo1  In  IP 142.251.223.106.443 > 192.168.0.108.34531: UDP, length 1250
16:41:21.959993 wlo1  In  IP 142.251.223.106.443 > 192.168.0.108.34531: UDP, length 1250
16:41:21.959994 wlo1  In  IP 142.251.223.106.443 > 192.168.0.108.34531: UDP, length 1250
16:41:21.959995 wlo1  In  IP 142.251.223.106.443 > 192.168.0.108.34531: UDP, length 1250
16:41:21.959996 wlo1  In  IP 142.251.223.106.443 > 192.168.0.108.34531: UDP, length 1250
16:41:21.959997 wlo1  In  IP 142.251.223.106.443 > 192.168.0.108.34531: UDP, length 1250
16:41:21.959998 wlo1  In  IP 142.251.223.106.443 > 192.168.0.108.34531: UDP, length 1250
16:41:21.959999 wlo1  In  IP 142.251.223.106.443 > 192.168.0.108.34531: UDP, length 1250
16:41:21.960050 wlo1  In  IP 142.251.223.106.443 > 192.168.0.108.34531: UDP, length 1250
16:41:21.960051 wlo1  In  IP 142.251.223.106.443 > 192.168.0.108.34531: UDP, length 1250
16:41:21.960051 wlo1  In  IP 142.251.223.106.443 > 192.168.0.108.34531: UDP, length 1250
16:41:21.960052 wlo1  In  IP 142.251.223.106.443 > 192.168.0.108.34531: UDP, length 1250
16:41:21.960053 wlo1  In  IP 142.251.223.106.443 > 192.168.0.108.34531: UDP, length 1250
16:41:21.960177 wlo1  Out IP 192.168.0.108.34531 > 142.251.223.106.443: UDP, length 32
16:41:21.960313 wlo1  Out IP 192.168.0.108.34531 > 142.251.223.106.443: UDP, length 32
16:41:21.963908 wlo1  Out IP 192.168.0.108.34531 > 142.251.223.106.443: UDP, length 33
16:41:22.043663 wlo1  In  IP 142.251.223.106.443 > 192.168.0.108.34531: UDP, length 1250
16:41:22.043665 wlo1  In  IP 142.251.223.106.443 > 192.168.0.108.34531: UDP, length 1250
16:41:22.043666 wlo1  In  IP 142.251.223.106.443 > 192.168.0.108.34531: UDP, length 1250
16:41:22.043667 wlo1  In  IP 142.251.223.106.443 > 192.168.0.108.34531: UDP, length 1250
16:41:22.043667 wlo1  In  IP 142.251.223.106.443 > 192.168.0.108.34531: UDP, length 1250
16:41:22.043668 wlo1  In  IP 142.251.223.106.443 > 192.168.0.108.34531: UDP, length 1250
16:41:22.043669 wlo1  In  IP 142.251.223.106.443 > 192.168.0.108.34531: UDP, length 1250
16:41:22.043669 wlo1  In  IP 142.251.223.106.443 > 192.168.0.108.34531: UDP, length 1250
16:41:22.043777 wlo1  In  IP 142.251.223.106.443 > 192.168.0.108.34531: UDP, length 1250
16:41:22.043778 wlo1  In  IP 142.251.223.106.443 > 192.168.0.108.34531: UDP, length 1250
16:41:22.043779 wlo1  In  IP 142.251.223.106.443 > 192.168.0.108.34531: UDP, length 1250
16:41:22.043780 wlo1  In  IP 142.251.223.106.443 > 192.168.0.108.34531: UDP, length 1250
16:41:22.043781 wlo1  In  IP 142.251.223.106.443 > 192.168.0.108.34531: UDP, length 1250
16:41:22.043781 wlo1  In  IP 142.251.223.106.443 > 192.168.0.108.34531: UDP, length 1250
16:41:22.043782 wlo1  In  IP 142.251.223.106.443 > 192.168.0.108.34531: UDP, length 1250
16:41:22.043784 wlo1  In  IP 142.251.223.106.443 > 192.168.0.108.34531: UDP, length 1250
16:41:22.043865 wlo1  In  IP 142.251.223.106.443 > 192.168.0.108.34531: UDP, length 1250
16:41:22.043867 wlo1  In  IP 142.251.223.106.443 > 192.168.0.108.34531: UDP, length 1250
16:41:22.043868 wlo1  In  IP 142.251.223.106.443 > 192.168.0.108.34531: UDP, length 1250
16:41:22.043869 wlo1  In  IP 142.251.223.106.443 > 192.168.0.108.34531: UDP, length 1250
16:41:22.043869 wlo1  In  IP 142.251.223.106.443 > 192.168.0.108.34531: UDP, length 1250
16:41:22.044180 wlo1  Out IP 192.168.0.108.34531 > 142.251.223.106.443: UDP, length 32
16:41:22.044332 wlo1  Out IP 192.168.0.108.34531 > 142.251.223.106.443: UDP, length 33
16:41:22.046871 wlo1  In  IP 142.251.223.106.443 > 192.168.0.108.34531: UDP, length 1250
16:41:22.046873 wlo1  In  IP 142.251.223.106.443 > 192.168.0.108.34531: UDP, length 1250
16:41:22.047178 wlo1  Out IP 192.168.0.108.34531 > 142.251.223.106.443: UDP, length 35
16:41:22.047264 wlo1  In  IP 142.251.223.106.443 > 192.168.0.108.34531: UDP, length 1250
16:41:22.047265 wlo1  In  IP 142.251.223.106.443 > 192.168.0.108.34531: UDP, length 1250
16:41:22.047266 wlo1  In  IP 142.251.223.106.443 > 192.168.0.108.34531: UDP, length 1250
16:41:22.047266 wlo1  In  IP 142.251.223.106.443 > 192.168.0.108.34531: UDP, length 1250
16:41:22.047267 wlo1  In  IP 142.251.223.106.443 > 192.168.0.108.34531: UDP, length 27
16:41:22.047268 wlo1  In  IP 142.251.223.106.443 > 192.168.0.108.34531: UDP, length 1250
16:41:22.047387 wlo1  Out IP 192.168.0.108.34531 > 142.251.223.106.443: UDP, length 35
16:41:22.047407 wlo1  Out IP 192.168.0.108.34531 > 142.251.223.106.443: UDP, length 35
16:41:22.047423 wlo1  Out IP 192.168.0.108.34531 > 142.251.223.106.443: UDP, length 35
16:41:22.047480 wlo1  Out IP 192.168.0.108.34531 > 142.251.223.106.443: UDP, length 36
16:41:22.051256 wlo1  In  IP 142.251.223.106.443 > 192.168.0.108.34531: UDP, length 1250
16:41:22.051257 wlo1  In  IP 142.251.223.106.443 > 192.168.0.108.34531: UDP, length 1250
16:41:22.051258 wlo1  In  IP 142.251.223.106.443 > 192.168.0.108.34531: UDP, length 1250
16:41:22.051259 wlo1  In  IP 142.251.223.106.443 > 192.168.0.108.34531: UDP, length 1250
16:41:22.051259 wlo1  In  IP 142.251.223.106.443 > 192.168.0.108.34531: UDP, length 1250
16:41:22.051260 wlo1  In  IP 142.251.223.106.443 > 192.168.0.108.34531: UDP, length 1250
16:41:22.051260 wlo1  In  IP 142.251.223.106.443 > 192.168.0.108.34531: UDP, length 1250
16:41:22.051261 wlo1  In  IP 142.251.223.106.443 > 192.168.0.108.34531: UDP, length 1250
16:41:22.051363 wlo1  In  IP 142.251.223.106.443 > 192.168.0.108.34531: UDP, length 1250
16:41:22.051364 wlo1  In  IP 142.251.223.106.443 > 192.168.0.108.34531: UDP, length 1250
16:41:22.051364 wlo1  In  IP 142.251.223.106.443 > 192.168.0.108.34531: UDP, length 1250
16:41:22.051365 wlo1  In  IP 142.251.223.106.443 > 192.168.0.108.34531: UDP, length 1250
16:41:22.051366 wlo1  In  IP 142.251.223.106.443 > 192.168.0.108.34531: UDP, length 1250
16:41:22.051367 wlo1  In  IP 142.251.223.106.443 > 192.168.0.108.34531: UDP, length 1250
16:41:22.051367 wlo1  In  IP 142.251.223.106.443 > 192.168.0.108.34531: UDP, length 1250
16:41:22.051368 wlo1  In  IP 142.251.223.106.443 > 192.168.0.108.34531: UDP, length 1250
16:41:22.051416 wlo1  In  IP 142.251.223.106.443 > 192.168.0.108.34531: UDP, length 1250
16:41:22.051416 wlo1  In  IP 142.251.223.106.443 > 192.168.0.108.34531: UDP, length 1250
16:41:22.051417 wlo1  In  IP 142.251.223.106.443 > 192.168.0.108.34531: UDP, length 1250
16:41:22.051418 wlo1  In  IP 142.251.223.106.443 > 192.168.0.108.34531: UDP, length 1250
16:41:22.051419 wlo1  In  IP 142.251.223.106.443 > 192.168.0.108.34531: UDP, length 1250
16:41:22.051687 wlo1  Out IP 192.168.0.108.34531 > 142.251.223.106.443: UDP, length 37
16:41:22.051767 wlo1  Out IP 192.168.0.108.34531 > 142.251.223.106.443: UDP, length 37
16:41:22.051789 wlo1  Out IP 192.168.0.108.34531 > 142.251.223.106.443: UDP, length 37
16:41:22.051810 wlo1  Out IP 192.168.0.108.34531 > 142.251.223.106.443: UDP, length 37
16:41:22.051834 wlo1  Out IP 192.168.0.108.34531 > 142.251.223.106.443: UDP, length 37
16:41:22.051858 wlo1  Out IP 192.168.0.108.34531 > 142.251.223.106.443: UDP, length 37
16:41:22.051879 wlo1  Out IP 192.168.0.108.34531 > 142.251.223.106.443: UDP, length 37
16:41:22.051899 wlo1  Out IP 192.168.0.108.34531 > 142.251.223.106.443: UDP, length 37
16:41:22.051918 wlo1  Out IP 192.168.0.108.34531 > 142.251.223.106.443: UDP, length 37
16:41:22.051944 wlo1  Out IP 192.168.0.108.34531 > 142.251.223.106.443: UDP, length 42
16:41:22.051979 wlo1  Out IP 192.168.0.108.34531 > 142.251.223.106.443: UDP, length 37
16:41:22.051999 wlo1  Out IP 192.168.0.108.34531 > 142.251.223.106.443: UDP, length 37
16:41:22.052021 wlo1  Out IP 192.168.0.108.34531 > 142.251.223.106.443: UDP, length 37
16:41:22.052040 wlo1  Out IP 192.168.0.108.34531 > 142.251.223.106.443: UDP, length 38
16:41:22.052067 wlo1  Out IP 192.168.0.108.34531 > 142.251.223.106.443: UDP, length 38
16:41:22.052086 wlo1  Out IP 192.168.0.108.34531 > 142.251.223.106.443: UDP, length 38
16:41:22.052105 wlo1  Out IP 192.168.0.108.34531 > 142.251.223.106.443: UDP, length 38
16:41:22.052125 wlo1  Out IP 192.168.0.108.34531 > 142.251.223.106.443: UDP, length 38
16:41:22.052144 wlo1  Out IP 192.168.0.108.34531 > 142.251.223.106.443: UDP, length 38
16:41:22.052166 wlo1  Out IP 192.168.0.108.34531 > 142.251.223.106.443: UDP, length 36
16:41:22.151009 wlo1  In  IP 142.251.223.106.443 > 192.168.0.108.34531: UDP, length 1250
16:41:22.151011 wlo1  In  IP 142.251.223.106.443 > 192.168.0.108.34531: UDP, length 1250
16:41:22.151012 wlo1  In  IP 142.251.223.106.443 > 192.168.0.108.34531: UDP, length 1250
16:41:22.151013 wlo1  In  IP 142.251.223.106.443 > 192.168.0.108.34531: UDP, length 1250
16:41:22.151013 wlo1  In  IP 142.251.223.106.443 > 192.168.0.108.34531: UDP, length 1250
16:41:22.151014 wlo1  In  IP 142.251.223.106.443 > 192.168.0.108.34531: UDP, length 1250
16:41:22.151014 wlo1  In  IP 142.251.223.106.443 > 192.168.0.108.34531: UDP, length 1250
16:41:22.151332 wlo1  Out IP 192.168.0.108.34531 > 142.251.223.106.443: UDP, length 35
16:41:22.151416 wlo1  Out IP 192.168.0.108.34531 > 142.251.223.106.443: UDP, length 35
16:41:22.151434 wlo1  Out IP 192.168.0.108.34531 > 142.251.223.106.443: UDP, length 35
16:41:22.154232 wlo1  In  IP 142.251.223.106.443 > 192.168.0.108.34531: UDP, length 1250
16:41:22.154234 wlo1  In  IP 142.251.223.106.443 > 192.168.0.108.34531: UDP, length 1250
16:41:22.154234 wlo1  In  IP 142.251.223.106.443 > 192.168.0.108.34531: UDP, length 1250
16:41:22.154235 wlo1  In  IP 142.251.223.106.443 > 192.168.0.108.34531: UDP, length 1250
16:41:22.154236 wlo1  In  IP 142.251.223.106.443 > 192.168.0.108.34531: UDP, length 1250
16:41:22.154238 wlo1  In  IP 142.251.223.106.443 > 192.168.0.108.34531: UDP, length 1250
16:41:22.154239 wlo1  In  IP 142.251.223.106.443 > 192.168.0.108.34531: UDP, length 1250
16:41:22.154239 wlo1  In  IP 142.251.223.106.443 > 192.168.0.108.34531: UDP, length 1250
16:41:22.154340 wlo1  In  IP 142.251.223.106.443 > 192.168.0.108.34531: UDP, length 1250
16:41:22.154341 wlo1  In  IP 142.251.223.106.443 > 192.168.0.108.34531: UDP, length 1250
16:41:22.154342 wlo1  In  IP 142.251.223.106.443 > 192.168.0.108.34531: UDP, length 1250
16:41:22.154343 wlo1  In  IP 142.251.223.106.443 > 192.168.0.108.34531: UDP, length 1250
16:41:22.154344 wlo1  In  IP 142.251.223.106.443 > 192.168.0.108.34531: UDP, length 1250
16:41:22.154344 wlo1  In  IP 142.251.223.106.443 > 192.168.0.108.34531: UDP, length 1250
16:41:22.154345 wlo1  In  IP 142.251.223.106.443 > 192.168.0.108.34531: UDP, length 1250
16:41:22.154346 wlo1  In  IP 142.251.223.106.443 > 192.168.0.108.34531: UDP, length 1250
16:41:22.154396 wlo1  In  IP 142.251.223.106.443 > 192.168.0.108.34531: UDP, length 1250
16:41:22.154397 wlo1  In  IP 142.251.223.106.443 > 192.168.0.108.34531: UDP, length 1250
16:41:22.154397 wlo1  In  IP 142.251.223.106.443 > 192.168.0.108.34531: UDP, length 1250
16:41:22.154398 wlo1  In  IP 142.251.223.106.443 > 192.168.0.108.34531: UDP, length 1250
16:41:22.154399 wlo1  In  IP 142.251.223.106.443 > 192.168.0.108.34531: UDP, length 1250
16:41:22.154724 wlo1  Out IP 192.168.0.108.34531 > 142.251.223.106.443: UDP, length 35
16:41:22.154905 wlo1  Out IP 192.168.0.108.34531 > 142.251.223.106.443: UDP, length 35
16:41:22.155049 wlo1  Out IP 192.168.0.108.34531 > 142.251.223.106.443: UDP, length 35
16:41:22.157552 wlo1  In  IP 142.251.223.106.443 > 192.168.0.108.34531: UDP, length 1250
16:41:22.157555 wlo1  In  IP 142.251.223.106.443 > 192.168.0.108.34531: UDP, length 1250
16:41:22.157556 wlo1  In  IP 142.251.223.106.443 > 192.168.0.108.34531: UDP, length 1250
16:41:22.157557 wlo1  In  IP 142.251.223.106.443 > 192.168.0.108.34531: UDP, length 1250
16:41:22.157558 wlo1  In  IP 142.251.223.106.443 > 192.168.0.108.34531: UDP, length 1250
16:41:22.157559 wlo1  In  IP 142.251.223.106.443 > 192.168.0.108.34531: UDP, length 1250
16:41:22.157560 wlo1  In  IP 142.251.223.106.443 > 192.168.0.108.34531: UDP, length 1250
16:41:22.157561 wlo1  In  IP 142.251.223.106.443 > 192.168.0.108.34531: UDP, length 1250
16:41:22.157667 wlo1  In  IP 142.251.223.106.443 > 192.168.0.108.34531: UDP, length 1250
16:41:22.157668 wlo1  In  IP 142.251.223.106.443 > 192.168.0.108.34531: UDP, length 1250
16:41:22.157669 wlo1  In  IP 142.251.223.106.443 > 192.168.0.108.34531: UDP, length 1250
16:41:22.157670 wlo1  In  IP 142.251.223.106.443 > 192.168.0.108.34531: UDP, length 1250
16:41:22.157671 wlo1  In  IP 142.251.223.106.443 > 192.168.0.108.34531: UDP, length 1250
16:41:22.157672 wlo1  In  IP 142.251.223.106.443 > 192.168.0.108.34531: UDP, length 1250
16:41:22.157673 wlo1  In  IP 142.251.223.106.443 > 192.168.0.108.34531: UDP, length 1250
16:41:22.157673 wlo1  In  IP 142.251.223.106.443 > 192.168.0.108.34531: UDP, length 1250
16:41:22.157734 wlo1  In  IP 142.251.223.106.443 > 192.168.0.108.34531: UDP, length 1250
16:41:22.157735 wlo1  In  IP 142.251.223.106.443 > 192.168.0.108.34531: UDP, length 1250
16:41:22.157736 wlo1  In  IP 142.251.223.106.443 > 192.168.0.108.34531: UDP, length 1250
16:41:22.157737 wlo1  In  IP 142.251.223.106.443 > 192.168.0.108.34531: UDP, length 1250
16:41:22.157739 wlo1  In  IP 142.251.223.106.443 > 192.168.0.108.34531: UDP, length 1250
16:41:22.157782 wlo1  In  IP 142.251.223.106.443 > 192.168.0.108.34531: UDP, length 1250
16:41:22.157782 wlo1  In  IP 142.251.223.106.443 > 192.168.0.108.34531: UDP, length 1039
16:41:22.158202 wlo1  Out IP 192.168.0.108.34531 > 142.251.223.106.443: UDP, length 32
16:41:22.158361 wlo1  Out IP 192.168.0.108.34531 > 142.251.223.106.443: UDP, length 32
16:41:22.161945 wlo1  Out IP 192.168.0.108.34531 > 142.251.223.106.443: UDP, length 33
16:41:22.417441 wlo1  Out IP 192.168.0.108.38412 > 192.168.0.1.53: 1305+ [1au] HTTPS? api1.sider.ai. (42)
16:41:22.417628 wlo1  Out IP 192.168.0.108.52154 > 192.168.0.1.53: 9833+ [1au] HTTPS? clicks-inges-vjld0bvlni6m-1474043380.us-east-1.elb.amazonaws.com. (93)
16:41:23.018812 wlo1  Out IP 192.168.0.108.44160 > 54.186.61.241.443: Flags [.], ack 2149944458, win 63, options [nop,nop,TS val 2199399443 ecr 1147108996], length 0
16:41:23.308177 wlo1  In  IP 54.186.61.241.443 > 192.168.0.108.44160: Flags [.], ack 1, win 187, options [nop,nop,TS val 1147156971 ecr 2199351856], length 0
16:41:23.381056 wlo1  In  IP 104.18.39.21.443 > 192.168.0.108.41652: Flags [P.], seq 103:127, ack 119, win 17, options [nop,nop,TS val 1402806230 ecr 1089317362], length 24
16:41:23.381173 wlo1  Out IP 192.168.0.108.41652 > 104.18.39.21.443: Flags [.], ack 127, win 59, options [nop,nop,TS val 1089332027 ecr 1402806230], length 0
16:41:23.381844 wlo1  Out IP 192.168.0.108.41652 > 104.18.39.21.443: Flags [P.], seq 119:147, ack 127, win 59, options [nop,nop,TS val 1089332028 ecr 1402806230], length 28
16:41:23.397852 wlo1  In  IP 104.18.39.21.443 > 192.168.0.108.41652: Flags [.], ack 147, win 17, options [nop,nop,TS val 1402806268 ecr 1089332028], length 0
16:41:23.417787 wlo1  Out IP 192.168.0.108.52223 > 192.168.0.1.53: 58068+ [1au] HTTPS? www-alv.google-analytics.com. (57)
16:41:23.917404 wlo1  Out IP 192.168.0.108.46857 > 192.168.0.1.53: 22998+ [1au] HTTPS? ssl.gstatic.com. (44)
16:41:24.417424 wlo1  Out IP 192.168.0.108.34666 > 192.168.0.1.53: 22164+ [1au] HTTPS? beacons-handoff.gcp.gvt2.com. (57)
16:41:24.667489 wlo1  Out IP 192.168.0.108.45364 > 192.168.0.1.53: 6842+ [1au] HTTPS? www.googleapis.com. (47)
16:41:26.417430 wlo1  Out IP 192.168.0.108.57158 > 192.168.0.1.53: 14812+ [1au] HTTPS? live.github.com. (44)
16:41:26.917477 wlo1  Out IP 192.168.0.108.43052 > 192.168.0.1.53: 38072+ [1au] HTTPS? collector.quillbot.com. (51)
16:41:26.917608 wlo1  Out IP 192.168.0.108.55169 > 192.168.0.1.53: 12045+ [1au] HTTPS? api2.amplitude.com. (47)
16:41:27.114854 wlo1  Out IP 192.168.0.108.50154 > 49.44.50.72.443: Flags [.], ack 287467081, win 63, options [nop,nop,TS val 1028170684 ecr 989329840], length 0
16:41:27.114940 wlo1  Out IP 192.168.0.108.39358 > 104.18.32.47.443: Flags [.], ack 1056795400, win 60, options [nop,nop,TS val 805673825 ecr 3694401451], length 0
16:41:27.131834 wlo1  In  IP 49.44.50.72.443 > 192.168.0.108.50154: Flags [.], ack 1, win 567, options [nop,nop,TS val 989374897 ecr 1027850657], length 0
16:41:27.157014 wlo1  In  IP 104.18.32.47.443 > 192.168.0.108.39358: Flags [.], ack 1, win 17, options [nop,nop,TS val 3694446508 ecr 805397218], length 0
16:41:27.667465 wlo1  Out IP 192.168.0.108.38412 > 192.168.0.1.53: 1305+ [1au] HTTPS? api1.sider.ai. (42)
16:41:27.667602 wlo1  Out IP 192.168.0.108.52154 > 192.168.0.1.53: 9833+ [1au] HTTPS? clicks-inges-vjld0bvlni6m-1474043380.us-east-1.elb.amazonaws.com. (93)
16:41:28.667391 wlo1  Out IP 192.168.0.108.52223 > 192.168.0.1.53: 58068+ [1au] HTTPS? www-alv.google-analytics.com. (57)
16:41:28.917440 wlo1  Out IP 192.168.0.108.46857 > 192.168.0.1.53: 22998+ [1au] HTTPS? ssl.gstatic.com. (44)
16:41:29.667489 wlo1  Out IP 192.168.0.108.34666 > 192.168.0.1.53: 22164+ [1au] HTTPS? beacons-handoff.gcp.gvt2.com. (57)
16:41:29.667582 wlo1  Out IP 192.168.0.108.45364 > 192.168.0.1.53: 6842+ [1au] HTTPS? www.googleapis.com. (47)
16:41:30.829578 wlo1  Out IP 192.168.0.108.55407 > 142.251.223.100.443: UDP, length 29
16:41:30.844941 wlo1  In  IP 142.251.223.100.443 > 192.168.0.108.55407: UDP, length 26
16:41:31.667429 wlo1  Out IP 192.168.0.108.57158 > 192.168.0.1.53: 14812+ [1au] HTTPS? live.github.com. (44)
16:41:32.167454 wlo1  Out IP 192.168.0.108.43052 > 192.168.0.1.53: 38072+ [1au] HTTPS? collector.quillbot.com. (51)
16:41:32.167603 wlo1  Out IP 192.168.0.108.55169 > 192.168.0.1.53: 12045+ [1au] HTTPS? api2.amplitude.com. (47)
16:41:32.917431 wlo1  Out IP 192.168.0.108.38412 > 192.168.0.1.53: 1305+ [1au] HTTPS? api1.sider.ai. (42)
16:41:32.917522 wlo1  Out IP 192.168.0.108.52154 > 192.168.0.1.53: 9833+ [1au] HTTPS? clicks-inges-vjld0bvlni6m-1474043380.us-east-1.elb.amazonaws.com. (93)
16:41:32.986920 wlo1  In  IP 163.70.145.60.5222 > 192.168.0.108.36606: Flags [P.], seq 72:296, ack 69, win 379, options [nop,nop,TS val 409843640 ecr 746043850], length 224
16:41:32.987021 wlo1  Out IP 192.168.0.108.36606 > 163.70.145.60.5222: Flags [.], ack 296, win 56, options [nop,nop,TS val 746058378 ecr 409843640], length 0
16:41:33.105024 wlo1  Out IP 192.168.0.108.36606 > 163.70.145.60.5222: Flags [P.], seq 69:142, ack 296, win 56, options [nop,nop,TS val 746058496 ecr 409843640], length 73
16:41:33.145113 wlo1  In  IP 163.70.145.60.5222 > 192.168.0.108.36606: Flags [.], ack 142, win 379, options [nop,nop,TS val 409843773 ecr 746058496], length 0
16:41:33.917479 wlo1  Out IP 192.168.0.108.52223 > 192.168.0.1.53: 58068+ [1au] HTTPS? www-alv.google-analytics.com. (57)
16:41:34.582223 wlo1  Out IP 192.168.0.108.36606 > 163.70.145.60.5222: Flags [P.], seq 142:211, ack 296, win 56, options [nop,nop,TS val 746059973 ecr 409843773], length 69
16:41:34.597971 wlo1  In  IP 163.70.145.60.5222 > 192.168.0.108.36606: Flags [.], ack 211, win 379, options [nop,nop,TS val 409845252 ecr 746059973], length 0
16:41:34.842422 wlo1  In  IP 163.70.145.60.5222 > 192.168.0.108.36606: Flags [P.], seq 296:367, ack 211, win 379, options [nop,nop,TS val 409845464 ecr 746059973], length 71
16:41:34.842515 wlo1  Out IP 192.168.0.108.36606 > 163.70.145.60.5222: Flags [.], ack 367, win 56, options [nop,nop,TS val 746060233 ecr 409845464], length 0
16:41:34.891199 wlo1  In  IP 104.18.36.252.443 > 192.168.0.108.54276: Flags [P.], seq 269:404, ack 297, win 18, options [nop,nop,TS val 2408457582 ecr 3037543602], length 135
16:41:34.891816 wlo1  Out IP 192.168.0.108.54276 > 104.18.36.252.443: Flags [P.], seq 297:325, ack 404, win 61, options [nop,nop,TS val 3037558586 ecr 2408457582], length 28
16:41:34.892850 wlo1  Out IP 192.168.0.108.54276 > 104.18.36.252.443: Flags [P.], seq 325:445, ack 404, win 61, options [nop,nop,TS val 3037558587 ecr 2408457582], length 120
16:41:34.907195 wlo1  In  IP 104.18.36.252.443 > 192.168.0.108.54276: Flags [.], ack 325, win 18, options [nop,nop,TS val 2408457598 ecr 3037558586], length 0
16:41:34.908096 wlo1  In  IP 104.18.36.252.443 > 192.168.0.108.54276: Flags [.], ack 445, win 18, options [nop,nop,TS val 2408457599 ecr 3037558587], length 0
16:41:34.917634 wlo1  Out IP 192.168.0.108.34666 > 192.168.0.1.53: 22164+ [1au] HTTPS? beacons-handoff.gcp.gvt2.com. (57)
16:41:34.917746 wlo1  Out IP 192.168.0.108.45364 > 192.168.0.1.53: 6842+ [1au] HTTPS? www.googleapis.com. (47)
16:41:35.306754 wlo1  Out IP 192.168.0.108.50462 > 34.8.7.18.443: Flags [.], ack 195079621, win 63, options [nop,nop,TS val 2491513070 ecr 2397791407], length 0
16:41:35.306805 wlo1  Out IP 192.168.0.108.50470 > 34.8.7.18.443: Flags [.], ack 558734880, win 63, options [nop,nop,TS val 2491513070 ecr 1614957332], length 0
16:41:35.323250 wlo1  In  IP 34.8.7.18.443 > 192.168.0.108.50462: Flags [.], ack 1, win 1043, options [nop,nop,TS val 2397836464 ecr 2491420049], length 0
16:41:35.323277 wlo1  In  IP 34.8.7.18.443 > 192.168.0.108.50470: Flags [.], ack 1, win 1043, options [nop,nop,TS val 1615002389 ecr 2491420049], length 0
16:41:35.822055 wlo1  Out IP 192.168.0.108.41652 > 104.18.39.21.443: Flags [P.], seq 147:237, ack 127, win 59, options [nop,nop,TS val 1089344468 ecr 1402806268], length 90
16:41:35.840242 wlo1  In  IP 104.18.39.21.443 > 192.168.0.108.41652: Flags [.], ack 237, win 17, options [nop,nop,TS val 1402818712 ecr 1089344468], length 0
16:41:36.175441 wlo1  In  IP 104.18.39.21.443 > 192.168.0.108.41652: Flags [P.], seq 127:206, ack 237, win 17, options [nop,nop,TS val 1402818921 ecr 1089344468], length 79
16:41:36.215603 wlo1  Out IP 192.168.0.108.41652 > 104.18.39.21.443: Flags [.], ack 206, win 59, options [nop,nop,TS val 1089344862 ecr 1402818921], length 0
16:41:36.917407 wlo1  Out IP 192.168.0.108.57158 > 192.168.0.1.53: 14812+ [1au] HTTPS? live.github.com. (44)
16:41:37.417575 wlo1  Out IP 192.168.0.108.43052 > 192.168.0.1.53: 38072+ [1au] HTTPS? collector.quillbot.com. (51)
16:41:37.417766 wlo1  Out IP 192.168.0.108.55169 > 192.168.0.1.53: 12045+ [1au] HTTPS? api2.amplitude.com. (47)
16:41:38.167559 wlo1  Out IP 192.168.0.108.38412 > 192.168.0.1.53: 1305+ [1au] HTTPS? api1.sider.ai. (42)
16:41:38.167681 wlo1  Out IP 192.168.0.108.52154 > 192.168.0.1.53: 9833+ [1au] HTTPS? clicks-inges-vjld0bvlni6m-1474043380.us-east-1.elb.amazonaws.com. (93)
16:41:39.167509 wlo1  Out IP 192.168.0.108.52223 > 192.168.0.1.53: 58068+ [1au] HTTPS? www-alv.google-analytics.com. (57)
16:41:39.402619 wlo1  Out IP 192.168.0.108.44176 > 54.186.61.241.443: Flags [.], ack 112869670, win 60, options [nop,nop,TS val 2199415827 ecr 1147126769], length 0
16:41:39.761197 wlo1  In  IP 54.186.61.241.443 > 192.168.0.108.44176: Flags [.], ack 1, win 342, options [nop,nop,TS val 1147173361 ecr 2199323591], length 0
16:41:40.167428 wlo1  Out IP 192.168.0.108.34666 > 192.168.0.1.53: 22164+ [1au] HTTPS? beacons-handoff.gcp.gvt2.com. (57)
16:41:40.167505 wlo1  Out IP 192.168.0.108.45364 > 192.168.0.1.53: 6842+ [1au] HTTPS? www.googleapis.com. (47)
16:41:41.125730 wlo1  Out IP 192.168.0.108.36820 > 142.251.223.100.443: UDP, length 1250
16:41:41.125775 wlo1  Out IP 192.168.0.108.36820 > 142.251.223.100.443: UDP, length 1250
16:41:41.125796 wlo1  Out IP 192.168.0.108.36820 > 142.251.223.100.443: UDP, length 1250
16:41:41.126009 wlo1  Out IP 192.168.0.108.36820 > 142.251.223.100.443: UDP, length 82
16:41:41.126410 wlo1  Out IP 192.168.0.108.36820 > 142.251.223.100.443: UDP, length 1246
16:41:41.126423 wlo1  Out IP 192.168.0.108.36820 > 142.251.223.100.443: UDP, length 1176
16:41:41.130284 wlo1  Out IP 192.168.0.108.57500 > 142.251.223.100.443: UDP, length 1250
16:41:41.130378 wlo1  Out IP 192.168.0.108.57500 > 142.251.223.100.443: UDP, length 1250
16:41:41.130606 wlo1  Out IP 192.168.0.108.57500 > 142.251.223.100.443: UDP, length 75
16:41:41.130980 wlo1  Out IP 192.168.0.108.57500 > 142.251.223.100.443: UDP, length 1246
16:41:41.130991 wlo1  Out IP 192.168.0.108.57500 > 142.251.223.100.443: UDP, length 868
16:41:41.145074 wlo1  In  IP 142.251.223.100.443 > 192.168.0.108.57500: UDP, length 40
16:41:41.146214 wlo1  In  IP 142.251.223.100.443 > 192.168.0.108.36820: UDP, length 40
16:41:41.146215 wlo1  In  IP 142.251.223.100.443 > 192.168.0.108.36820: UDP, length 40
16:41:41.146217 wlo1  In  IP 142.251.223.100.443 > 192.168.0.108.36820: UDP, length 1250
16:41:41.146217 wlo1  In  IP 142.251.223.100.443 > 192.168.0.108.36820: UDP, length 1250
16:41:41.146218 wlo1  In  IP 142.251.223.100.443 > 192.168.0.108.36820: UDP, length 1250
16:41:41.146219 wlo1  In  IP 142.251.223.100.443 > 192.168.0.108.36820: UDP, length 296
16:41:41.146220 wlo1  In  IP 142.251.223.100.443 > 192.168.0.108.36820: UDP, length 954
16:41:41.146291 wlo1  In  IP 142.251.223.100.443 > 192.168.0.108.57500: UDP, length 1250
16:41:41.147363 wlo1  Out IP 192.168.0.108.36820 > 142.251.223.100.443: UDP, length 78
16:41:41.147466 wlo1  Out IP 192.168.0.108.36820 > 142.251.223.100.443: UDP, length 31
16:41:41.149733 wlo1  In  IP 142.251.223.100.443 > 192.168.0.108.36820: UDP, length 69
16:41:41.149734 wlo1  In  IP 142.251.223.100.443 > 192.168.0.108.36820: UDP, length 24
16:41:41.149735 wlo1  In  IP 142.251.223.100.443 > 192.168.0.108.36820: UDP, length 1246
16:41:41.149736 wlo1  In  IP 142.251.223.100.443 > 192.168.0.108.36820: UDP, length 800
16:41:41.149799 wlo1  In  IP 142.251.223.100.443 > 192.168.0.108.57500: UDP, length 1250
16:41:41.149800 wlo1  In  IP 142.251.223.100.443 > 192.168.0.108.57500: UDP, length 305
16:41:41.149800 wlo1  In  IP 142.251.223.100.443 > 192.168.0.108.57500: UDP, length 945
16:41:41.149801 wlo1  In  IP 142.251.223.100.443 > 192.168.0.108.57500: UDP, length 78
16:41:41.149801 wlo1  In  IP 142.251.223.100.443 > 192.168.0.108.57500: UDP, length 24
16:41:41.149801 wlo1  In  IP 142.251.223.100.443 > 192.168.0.108.57500: UDP, length 22
16:41:41.150309 wlo1  Out IP 192.168.0.108.36820 > 142.251.223.100.443: UDP, length 35
16:41:41.151036 wlo1  Out IP 192.168.0.108.57500 > 142.251.223.100.443: UDP, length 78
16:41:41.151115 wlo1  Out IP 192.168.0.108.57500 > 142.251.223.100.443: UDP, length 31
16:41:41.151206 wlo1  Out IP 192.168.0.108.57500 > 142.251.223.100.443: UDP, length 31
16:41:41.164214 wlo1  In  IP 142.251.223.100.443 > 192.168.0.108.36820: UDP, length 121
16:41:41.164215 wlo1  In  IP 142.251.223.100.443 > 192.168.0.108.36820: UDP, length 23
16:41:41.164269 wlo1  In  IP 142.251.223.100.443 > 192.168.0.108.57500: UDP, length 120
16:41:41.164574 wlo1  Out IP 192.168.0.108.36820 > 142.251.223.100.443: UDP, length 31
16:41:41.190012 wlo1  Out IP 192.168.0.108.57500 > 142.251.223.100.443: UDP, length 32
16:41:41.230609 wlo1  In  IP 142.251.223.100.443 > 192.168.0.108.57500: UDP, length 1246
16:41:41.230611 wlo1  In  IP 142.251.223.100.443 > 192.168.0.108.57500: UDP, length 875
16:41:41.231213 wlo1  Out IP 192.168.0.108.57500 > 142.251.223.100.443: UDP, length 35
16:41:41.248024 wlo1  In  IP 142.251.223.100.443 > 192.168.0.108.57500: UDP, length 23
16:41:42.114227 wlo1  In  IP 157.90.91.73.443 > 192.168.0.108.55670: Flags [P.], seq 1:25, ack 1, win 490, options [nop,nop,TS val 2626606118 ecr 2514115000], length 24
16:41:42.114717 wlo1  Out IP 192.168.0.108.55670 > 157.90.91.73.443: Flags [P.], seq 1:29, ack 25, win 51, options [nop,nop,TS val 2514234512 ecr 2626606118], length 28
16:41:42.167598 wlo1  Out IP 192.168.0.108.57158 > 192.168.0.1.53: 14812+ [1au] HTTPS? live.github.com. (44)
16:41:42.319105 wlo1  In  IP 157.90.91.73.443 > 192.168.0.108.55670: Flags [.], ack 29, win 490, options [nop,nop,TS val 2626606363 ecr 2514234512], length 0
16:41:42.667388 wlo1  Out IP 192.168.0.108.43052 > 192.168.0.1.53: 38072+ [1au] HTTPS? collector.quillbot.com. (51)
16:41:42.667483 wlo1  Out IP 192.168.0.108.55169 > 192.168.0.1.53: 12045+ [1au] HTTPS? api2.amplitude.com. (47)
16:41:43.417492 wlo1  Out IP 192.168.0.108.38412 > 192.168.0.1.53: 1305+ [1au] HTTPS? api1.sider.ai. (42)
16:41:43.417623 wlo1  Out IP 192.168.0.108.52154 > 192.168.0.1.53: 9833+ [1au] HTTPS? clicks-inges-vjld0bvlni6m-1474043380.us-east-1.elb.amazonaws.com. (93)
16:41:43.423143 wlo1  In  IP 104.18.39.21.443 > 192.168.0.108.41652: Flags [P.], seq 206:230, ack 237, win 17, options [nop,nop,TS val 1402826241 ecr 1089344862], length 24
16:41:43.423207 wlo1  Out IP 192.168.0.108.41652 > 104.18.39.21.443: Flags [.], ack 230, win 59, options [nop,nop,TS val 1089352069 ecr 1402826241], length 0
16:41:43.423795 wlo1  Out IP 192.168.0.108.41652 > 104.18.39.21.443: Flags [P.], seq 237:265, ack 230, win 59, options [nop,nop,TS val 1089352070 ecr 1402826241], length 28
16:41:43.438950 wlo1  In  IP 104.18.39.21.443 > 192.168.0.108.41652: Flags [.], ack 265, win 17, options [nop,nop,TS val 1402826310 ecr 1089352070], length 0
16:41:44.417457 wlo1  Out IP 192.168.0.108.52223 > 192.168.0.1.53: 58068+ [1au] HTTPS? www-alv.google-analytics.com. (57)
16:41:45.417392 wlo1  Out IP 192.168.0.108.34666 > 192.168.0.1.53: 22164+ [1au] HTTPS? beacons-handoff.gcp.gvt2.com. (57)
16:41:45.417462 wlo1  Out IP 192.168.0.108.45364 > 192.168.0.1.53: 6842+ [1au] HTTPS? www.googleapis.com. (47)
16:41:47.402629 wlo1  Out IP 192.168.0.108.38006 > 16.15.191.255.443: Flags [.], ack 25, win 57, options [nop,nop,TS val 3101278668 ecr 1300837354], length 0
16:41:47.417634 wlo1  Out IP 192.168.0.108.57158 > 192.168.0.1.53: 14812+ [1au] HTTPS? live.github.com. (44)
16:41:47.594653 wlo1  Out IP 192.168.0.108.40788 > 49.44.50.72.443: Flags [.], ack 1, win 63, options [nop,nop,TS val 1028191164 ecr 989350319], length 0
16:41:47.594748 wlo1  Out IP 192.168.0.108.56456 > 3.213.49.30.443: Flags [.], ack 1, win 59, options [nop,nop,TS val 3134987817 ecr 1015168614], length 0
16:41:47.594823 wlo1  Out IP 192.168.0.108.53504 > 172.66.161.126.443: Flags [.], ack 1, win 334, options [nop,nop,TS val 54197892 ecr 4264669824], length 0
16:41:47.594860 wlo1  Out IP 192.168.0.108.55814 > 157.90.91.73.443: Flags [.], ack 1, win 54, options [nop,nop,TS val 2514239992 ecr 2626564227], length 0
16:41:47.594873 wlo1  Out IP 192.168.0.108.35306 > 74.125.200.188.5228: Flags [.], ack 1433888334, win 57, options [nop,nop,TS val 2575638851 ecr 2430567674], length 0
16:41:47.614231 wlo1  In  IP 49.44.50.72.443 > 192.168.0.108.40788: Flags [.], ack 1, win 567, options [nop,nop,TS val 989395379 ecr 1027784902], length 0
16:41:47.623620 wlo1  Out IP 192.168.0.108.35308 > 74.125.200.188.5228: Flags [.], ack 1, win 57, options [nop,nop,TS val 2575638880 ecr 916725721], length 0
16:41:47.643884 wlo1  In  IP 16.15.191.255.443 > 192.168.0.108.38006: Flags [.], ack 1, win 224, options [nop,nop,TS val 1300882691 ecr 3101233688], length 0
16:41:47.676456 wlo1  In  IP 74.125.200.188.5228 > 192.168.0.108.35306: Flags [.], ack 1, win 1044, options [nop,nop,TS val 2430616670 ecr 2574433825], length 0
16:41:47.706997 wlo1  In  IP 74.125.200.188.5228 > 192.168.0.108.35308: Flags [.], ack 1, win 1044, options [nop,nop,TS val 916770806 ecr 2574433757], length 0
16:41:47.763235 wlo1  In  IP 157.90.91.73.443 > 192.168.0.108.55814: Flags [.], ack 1, win 487, options [nop,nop,TS val 2626611847 ecr 2514146930], length 0
16:41:47.844096 wlo1  In  IP 3.213.49.30.443 > 192.168.0.108.56456: Flags [.], ack 1, win 292, options [nop,nop,TS val 1015215207 ecr 3134895786], length 0
16:41:47.917394 wlo1  Out IP 192.168.0.108.43052 > 192.168.0.1.53: 38072+ [1au] HTTPS? collector.quillbot.com. (51)
16:41:47.917470 wlo1  Out IP 192.168.0.108.55169 > 192.168.0.1.53: 12045+ [1au] HTTPS? api2.amplitude.com. (47)
16:41:48.667523 wlo1  Out IP 192.168.0.108.38412 > 192.168.0.1.53: 1305+ [1au] HTTPS? api1.sider.ai. (42)
16:41:48.667663 wlo1  Out IP 192.168.0.108.52154 > 192.168.0.1.53: 9833+ [1au] HTTPS? clicks-inges-vjld0bvlni6m-1474043380.us-east-1.elb.amazonaws.com. (93)

824 packets captured
831 packets received by filter
0 packets dropped by kernel
