tcpdump: WARNING: any: That device doesn't support promiscuous mode
(Promiscuous mode not supported on the "any" device)
tcpdump: verbose output suppressed, use -v[v]... for full protocol decode
listening on any, link-type LINUX_SLL2 (Linux cooked v2), snapshot length 262144 bytes
16:34:32.234791 wlo1  In  ARP, Request who-has 192.168.0.108 tell 192.168.0.1, length 28
16:34:32.234804 wlo1  Out ARP, Reply 192.168.0.108 is-at 4a:2c:10:c6:25:3e, length 28
16:34:32.667400 wlo1  Out IP 192.168.0.108.57148 > 192.168.0.1.53: 55385+ [1au] HTTPS? android.l.google.com. (49)
16:34:33.918068 wlo1  Out IP 192.168.0.108.57672 > 192.168.0.1.53: 4503+ [1au] HTTPS? ssl.gstatic.com. (44)
16:34:37.917553 wlo1  Out IP 192.168.0.108.57148 > 192.168.0.1.53: 55385+ [1au] HTTPS? android.l.google.com. (49)
16:34:38.026818 wlo1  Out IP 192.168.0.108.35824 > 172.64.155.209.443: Flags [.], ack 3205109201, win 119, options [nop,nop,TS val 638096947 ecr 1701928130], length 0
16:34:38.093883 wlo1  In  IP 172.64.155.209.443 > 192.168.0.108.35824: Flags [.], ack 1, win 25, options [nop,nop,TS val 1701973640 ecr 638051396], length 0
16:34:39.167661 wlo1  Out IP 192.168.0.108.57672 > 192.168.0.1.53: 4503+ [1au] HTTPS? ssl.gstatic.com. (44)

8 packets captured
50 packets received by filter
0 packets dropped by kernel
