tcpdump: WARNING: any: That device doesn't support promiscuous mode
(Promiscuous mode not supported on the "any" device)
tcpdump: verbose output suppressed, use -v[v]... for full protocol decode
listening on any, link-type LINUX_SLL2 (Linux cooked v2), snapshot length 262144 bytes
16:33:28.417618 wlo1  Out IP 192.168.0.108.45756 > 192.168.0.1.53: 31775+ [1au] HTTPS? clicks-inges-vjld0bvlni6m-1474043380.us-east-1.elb.amazonaws.com. (93)
16:33:28.667511 wlo1  Out IP 192.168.0.108.42044 > 192.168.0.1.53: 55640+ [1au] HTTPS? ol-collector.quillbot.com. (54)
16:33:31.978586 wlo1  Out IP 192.168.0.108.36860 > 35.190.80.1.443: Flags [.], ack 197440743, win 60, options [nop,nop,TS val 2809445560 ecr 2659309487], length 0
16:33:31.994873 wlo1  In  IP 35.190.80.1.443 > 192.168.0.108.36860: Flags [.], ack 1, win 1043, options [nop,nop,TS val 2659354547 ecr 2808993604], length 0
16:33:33.667633 wlo1  Out IP 192.168.0.108.45756 > 192.168.0.1.53: 31775+ [1au] HTTPS? clicks-inges-vjld0bvlni6m-1474043380.us-east-1.elb.amazonaws.com. (93)
16:33:33.667738 wlo1  Out IP 192.168.0.108.42044 > 192.168.0.1.53: 55640+ [1au] HTTPS? ol-collector.quillbot.com. (54)

6 packets captured
6 packets received by filter
0 packets dropped by kernel
