tcpdump: WARNING: any: That device doesn't support promiscuous mode
(Promiscuous mode not supported on the "any" device)
tcpdump: verbose output suppressed, use -v[v]... for full protocol decode
listening on any, link-type LINUX_SLL2 (Linux cooked v2), snapshot length 262144 bytes
16:33:59.466206 wlo1  In  IP 100.49.119.149.443 > 192.168.0.108.41894: Flags [.], ack 1411045755, win 288, options [nop,nop,TS val 1935648712 ecr 4075623264], length 0
16:33:59.466270 wlo1  In  IP 140.82.114.25.443 > 192.168.0.108.51090: Flags [.], ack 244571399, win 85, options [nop,nop,TS val 1653900320 ecr 2543954451], length 0
16:33:59.917672 wlo1  Out IP 192.168.0.108.45756 > 192.168.0.1.53: 31775+ [1au] HTTPS? clicks-inges-vjld0bvlni6m-1474043380.us-east-1.elb.amazonaws.com. (93)
16:33:59.917785 wlo1  Out IP 192.168.0.108.42044 > 192.168.0.1.53: 55640+ [1au] HTTPS? ol-collector.quillbot.com. (54)
16:34:01.167694 wlo1  Out IP 192.168.0.108.57148 > 192.168.0.1.53: 55385+ [1au] HTTPS? android.l.google.com. (49)
16:34:03.460065 wlo1  In  IP 104.18.39.21.443 > 192.168.0.108.41652: Flags [P.], seq 307499409:307499433, ack 3033043760, win 17, options [nop,nop,TS val 1402366234 ecr 1088872138], length 24
16:34:03.460560 wlo1  Out IP 192.168.0.108.41652 > 104.18.39.21.443: Flags [P.], seq 1:29, ack 24, win 59, options [nop,nop,TS val 1088892106 ecr 1402366234], length 28
16:34:03.475873 wlo1  In  IP 104.18.39.21.443 > 192.168.0.108.41652: Flags [.], ack 29, win 17, options [nop,nop,TS val 1402366347 ecr 1088892106], length 0
16:34:04.746753 wlo1  Out IP 192.168.0.108.35308 > 74.125.200.188.5228: Flags [.], ack 1859589454, win 57, options [nop,nop,TS val 2575176003 ecr 916258850], length 0
16:34:04.746823 wlo1  Out IP 192.168.0.108.35306 > 74.125.200.188.5228: Flags [.], ack 1433888334, win 57, options [nop,nop,TS val 2575176003 ecr 2430104746], length 0
16:34:04.825942 wlo1  In  IP 74.125.200.188.5228 > 192.168.0.108.35306: Flags [.], ack 1, win 1044, options [nop,nop,TS val 2430153820 ecr 2574433825], length 0
16:34:04.832387 wlo1  In  IP 74.125.200.188.5228 > 192.168.0.108.35308: Flags [.], ack 1, win 1044, options [nop,nop,TS val 916307932 ecr 2574433757], length 0
16:34:05.167761 wlo1  Out IP 192.168.0.108.45756 > 192.168.0.1.53: 31775+ [1au] HTTPS? clicks-inges-vjld0bvlni6m-1474043380.us-east-1.elb.amazonaws.com. (93)
16:34:06.417584 wlo1  Out IP 192.168.0.108.57148 > 192.168.0.1.53: 55385+ [1au] HTTPS? android.l.google.com. (49)
16:34:06.602757 wlo1  Out IP 192.168.0.108.51618 > 49.44.50.72.443: Flags [.], ack 2767983697, win 61, options [nop,nop,TS val 1027730172 ecr 988889243], length 0
16:34:06.621011 wlo1  In  IP 49.44.50.72.443 > 192.168.0.108.51618: Flags [.], ack 1, win 550, options [nop,nop,TS val 988934385 ecr 1027685147], length 0
16:34:07.412571 wlo1  Out IP 192.168.0.108.37590 > 160.250.111.199.123: NTPv4, Client, length 48
16:34:07.455597 wlo1  In  IP 160.250.111.199.123 > 192.168.0.108.37590: NTPv4, Server, length 48
16:34:07.562874 wlo1  Out IP 192.168.0.108.54648 > 139.59.15.185.123: NTPv4, Client, length 48
16:34:07.621551 wlo1  In  IP 139.59.15.185.123 > 192.168.0.108.54648: NTPv4, Server, length 48
16:34:08.279123 wlo1  Out IP 192.168.0.108.59469 > 162.159.200.1.123: NTPv4, Client, length 48
16:34:08.299008 wlo1  In  IP 162.159.200.1.123 > 192.168.0.108.59469: NTPv4, Server, length 48

22 packets captured
22 packets received by filter
0 packets dropped by kernel
